Id	Sentence_1	Sentence_2	Class	Cosine_distance_layer_1	Cosine_distance_layer_2	Cosine_distance_layer_3	Cosine_distance_layer_4	Cosine_distance_layer_5	Cosine_distance_layer_6	Cosine_distance_layer_7	Cosine_distance_layer_8	Cosine_distance_layer_9	Cosine_distance_layer_10	Cosine_distance_layer_11	Cosine_distance_layer_12
173363	La gente mi guarda con un po' di sussiego però c'è qualcuno che si diverte e sorride un pochino.	Noi italiani siamo brava gente, non siamo razzisti, tutti fratelli e tutti uguali certo, magari quelli che hanno la pelle così scura non sono tanto uguali e se hanno la pelle scura magari una ragione ci sarà.	0	0.0199	0.0275	0.0537	0.0364	0.0436	0.044	0.0471	0.0463	0.0785	0.1083	0.4582	0.4452
73345	Ne ho uno in particolare che mi piace, il sogno di una bambina: Annachiara, di 8 anni, che mi aveva scambiato per un mix tra Babbo Natale e il genio della lampada.	Annachiara mi ha consegnato una vera e propria lista: 1. avere un chihuahua; 2. avere un Samsung; 3. un fidanzato; 4. volare; Interessante: fidanzato, poi volare!	0	0.0214	0.0323	0.0296	0.0226	0.0303	0.0302	0.0303	0.0383	0.0524	0.0425	0.0941	0.1383
195733	"È a Tokio, esiste, è un'experience: e non si chiama, come l'ho banalizzato io, ""Museo della Cacca"", ma si chiama ""Toilet?"	Ed è molto chiaro da questa frase.	1	0.0479	0.0768	0.0867	0.0649	0.0723	0.0703	0.0837	0.1092	0.1264	0.1605	0.3209	0.2551
135073	La madre.	È Toro Seduto.	1	0.054	0.0582	0.0591	0.0394	0.0555	0.0418	0.0448	0.0434	0.0502	0.1044	0.1095	0.1863
122631	Così ho deciso, e ho riflettuto sul fatto che in fondo, io, persona istintiva ed emotiva, ho sempre avuto le parole come uno strumento razionale, un contraltare alle mie decisioni nella mia vita di business.	E avevo 4 parole chiave, un acronimo: CCTY Questo era un sistema di decision making, io lo usavo per prendere decisioni.	0	0.0163	0.0338	0.0295	0.023	0.0243	0.0234	0.0224	0.0222	0.0276	0.0462	0.0438	0.0522
98839	Visto che parliamo di volo, le galline, che come sapete sono il mio animale favorito, e il vertice della creazione dal punto di vista cerebrale, sono capaci di fare una cosa di questo tipo, cioè di guardare sul terreno, mentre pascolano, con l'occhio destro, in cerca di qualche verme succulento, e nello stesso tempo, con l'occhio sinistro, di guardare in alto - emisfero destro - e tenere d'occhio l'ambiente, che non compaia qualche predatore alato.	E questa cosa la possono fare simultaneamente, in maniera molto efficiente, proprio perché hanno un cervello asimmetrico.	0	0.0254	0.052	0.0594	0.0441	0.0537	0.0558	0.0639	0.0911	0.1077	0.1335	0.1253	0.1141
331	Pensate, la Cina è entrata nel mercato turistico si dice.	Si cercano e si domandano gli investimenti.	0	0.0244	0.0278	0.0323	0.0238	0.0289	0.0289	0.0286	0.027	0.0405	0.0702	0.155	0.1753
54458	"Dopo 4 anni nel 1972, il Club di Roma pubblicò un rapporto dal titolo ""I limiti dello Sviluppo"", dove metteva in evidenza le problematiche alle quali si sarebbe andati incontro nei prossimi decenni se il modello di sviluppo non fosse cambiato."	Un gruppo intergovernativo sul cambiamento climatico fondato da due organismi delle Nazioni Unite: l'organizzazione Meteorologica Mondiale ed il programma delle Nazioni Unite per l'Ambiente.	1	0.0263	0.055	0.0717	0.0463	0.0503	0.0484	0.042	0.0534	0.0869	0.1334	0.1671	0.2127
3882	Il fatto è che noi siamo sempre gli stessi.	"Quella persona a cui dicevamo ""già"" prima e ""ancora"" dopo, è la stessa."	0	0.0495	0.0596	0.0482	0.0388	0.0407	0.0369	0.0391	0.0441	0.0458	0.0629	0.0544	0.1
189249	E poi si indebita nuovamente per 10.000 dollari.	Quindi legato a questo silos che trasporta esattamente quel biodiesel che è stato prodotto sul suo campo.	1	0.0398	0.0488	0.0409	0.0308	0.0357	0.053	0.0449	0.0621	0.0807	0.0937	0.1007	0.118
15128	Però, quando sono arrivato, invece, devo ammettere che ho scoperto una vera verità, ovvero che stavo commettendo un errore davvero, davvero grosso prima di partire.	Oppure, che una motivazione ben radicata come la mia possa farci superare barriere e ostacoli che la società odierna continua a costruirci ogni giorno attorno.	1	0.0174	0.0446	0.0339	0.0229	0.0298	0.0283	0.0318	0.0269	0.0299	0.0562	0.0391	0.0681
159673	E spedire qualcosa nello spazio costa un sacco di soldi.	Si stima che il costo totale effettivo sia quasi 60.000 euro al chilo.	0	0.037	0.046	0.0519	0.0392	0.0464	0.0545	0.0481	0.0455	0.0458	0.0832	0.085	0.1283
88960	Ecco, con la navigazione puramente digitale, parte di questo si rischia di perderlo; prima provocazione.	Quella è zona bonificata da palude.	1	0.037	0.0759	0.0797	0.0534	0.0572	0.0584	0.0584	0.0787	0.0899	0.1419	0.1265	0.1572
164529	Avrei voluto farlo veramente, ma era impossibile.	Questo è quello che ho voluto far capire ai miei ragazzi anche quest'anno, dentro alla scuola si entra per aprirsi al mondo e alla realtà, per scoprire sé.	1	0.034	0.06	0.0621	0.0534	0.0579	0.06	0.0651	0.096	0.1261	0.1923	0.3465	0.2837
5044	Oh mamma, diminuiscono, bene.	Eh sì, diminuiscono.	0	0.0333	0.0341	0.024	0.013	0.0197	0.0181	0.0239	0.0207	0.0203	0.0313	0.0829	0.1018
111065	Mi ricordo quella mattina: era prestissimo, mi sveglio con un freddo che non avevo mai provato prima.	Ogni volta che appoggiavo un piede a terra, sentivo un forte dolore come se camminassi su degli aghi, un dolore che piano piano saliva sempre di più.	1	0.0198	0.0329	0.0253	0.0181	0.0191	0.0203	0.019	0.0318	0.0358	0.0553	0.0371	0.0506
185391	E la loro caratteristica è che possono lavorare fianco a fianco con le persone.	Ma cosa succederebbe se, ad esempio, aprissimo casa nostra a un robot?	0	0.0321	0.0486	0.0417	0.0284	0.0319	0.0334	0.0284	0.0362	0.0437	0.08	0.1117	0.1534
38526	Inglese Più alto, per favore.	Hai pochi secondi per mescolare questo cubo e renderlo impossibile da risolvere.	1	0.0416	0.049	0.0551	0.0434	0.0518	0.0469	0.0523	0.062	0.0783	0.1238	0.2775	0.3312
7278	Mi piacerebbe capovolgere la vostra capacità di osservazione.	Siamo in vacanza, siamo al mare, non a caso.	0	0.0364	0.038	0.041	0.0284	0.0363	0.0352	0.0368	0.0351	0.056	0.1283	0.392	0.2673
32473	Il carcere è soprattutto privazione, non è solo perdita della libertà personale.	Privazione totale: non si può telefonare quando si vuole, non si può mangiare quello che si vuole, non si può vedere i propri cari quando si vuole, non si può assumere neanche una compressa per il mal di testa.	0	0.0267	0.0414	0.0402	0.0322	0.0367	0.0477	0.0526	0.0653	0.0644	0.0905	0.1933	0.3048
48049	Scrivere un libro di ricette mi sembrava quasi banale.	Poi, però, ho pensato che forse la parte di me, la parte creativa che non avevo mai sviluppato in precedenza, è proprio quella in cui potevo riuscire meglio.	1	0.0383	0.0563	0.0523	0.0367	0.0456	0.0381	0.0428	0.0534	0.0751	0.0964	0.0924	0.1114
148136	Lui si alzava ogni mattina all'alba, prendeva la sua tavola, percorreva a piedi le poche centinaia di metri che lo separavano dall'oceano, si buttava nel mare con un entusiasmo che non avevo mai visto nella mia vita, e quando era tra le onde, era la persona più felice del mondo.	"Ecco, se a lui avessero chiesto: ""Per cosa sei fatto?"	0	0.0455	0.0691	0.0627	0.0516	0.0501	0.0652	0.0714	0.1116	0.1174	0.1648	0.2179	0.1899
90888	Quindi è evidente che accadono cose on - line che noi non siamo in grado di interpretare perché 10 anni fa non c'erano.	On - line disinibisce.	1	0.0415	0.0549	0.0668	0.0474	0.0505	0.0505	0.057	0.0839	0.0971	0.171	0.1667	0.1
136448	E, in questo modo, ci riusciremo, come 70.000 anni fa, come sempre.	E allora vi chiedo: qual è la quantità di incertezza che siete disposti ad accettare oggi?	0	0.027	0.0492	0.0476	0.0341	0.0352	0.0368	0.0356	0.0383	0.0536	0.0637	0.059	0.1641
158035	È un logo che cambia forma.	Vedete la porta di Brandeburgo che è un claim piuttosto rigido e quindi un claim che non riesce ad esprimere le diversità, è stato reso molto più dinamico attraverso interventi di questo tipo.	1	0.0481	0.0745	0.0652	0.05	0.0508	0.0552	0.07	0.087	0.098	0.1168	0.0944	0.1466
177101	Devi mettere in discussione la tua identità, i tuoi punti di partenza, le tue certezze e le tue abitudini di sempre.	Ecco: se c'è qualcosa che ho imparato da tutto questo mio percorso interiore, è che la transizione più importante, forse quella più delicata ma anche la più urgente, deve avvenire al nostro interno.	0	0.0258	0.0428	0.055	0.0354	0.0386	0.0294	0.0365	0.0632	0.11	0.1764	0.2661	0.2218
111765	Confondere natura e agricoltura ci porta al paradosso per eccellenza, che è quello di rifiutare l'innovazione anche quando riduce l'impatto ambientale.	L'esempio più eclatante è quello del mais Bt.	0	0.0192	0.0428	0.0315	0.023	0.0255	0.0243	0.0274	0.0266	0.0238	0.0343	0.0418	0.0813
118748	E' un progetto che, come dicevo prima, non richiede poi così tanti capitali perché alla fine bastano 20 centesimi per ricordarsi di questa bella storia.	Le protagoniste della mia storia sono queste due signore di spalle: quella a destra è mia mamma, 81 anni; quella di sinistra, mia figlia, ne ha sette ma a volte, per quello che dice, sembra che ne abbia anche più di 81.	1	0.0186	0.0317	0.0509	0.0424	0.0463	0.0459	0.0422	0.0494	0.0594	0.0585	0.057	0.0748
40604	Da allora, si sono susseguite 7 versioni.	Ma tutto questo è sempre andato a discapito del peso, dovuto anche all'utilizzo massiccio di materiali a basso costo.	1	0.0262	0.0415	0.042	0.0313	0.0347	0.0421	0.0474	0.0734	0.0874	0.1224	0.138	0.1392
166244	Sì Lui ha detto: Re - start.	Era come Prometeo dedicato alla protezione della gente, dell'unità.	1	0.0364	0.05	0.0603	0.0433	0.0535	0.0528	0.0476	0.0649	0.0939	0.1514	0.1465	0.4763
82414	"Quindi questi atleti corrono sul tetto del soffitto, impattano con una palla, quindi quella roba lì diventa messaggio, è la ""man, motion, emotion""."	L'idea della piazza è la più grande idea architettonica italiana.	1	0.0311	0.0515	0.0566	0.0387	0.0448	0.0524	0.0508	0.0609	0.0725	0.0909	0.0792	0.1018
51835	Ma allora vediamo se nel paese che è l'emblema della modernità, cioè negli Stati Uniti, le cose sono andate nello stesso modo.	Poi si stabilizza, anzi c'è una leggera tendenza all'aumento, mentre da noi crolla.	1	0.0146	0.0235	0.02	0.0164	0.016	0.0144	0.0161	0.014	0.0111	0.0143	0.0285	0.0573
41048	Probabilmente è quello che so fare meglio.	O ancora, quando ho scalato sulle cascate di ghiaccio che sono pareti molto delicate e infide e mutevoli.	1	0.0361	0.0795	0.0565	0.0428	0.0515	0.0528	0.0561	0.0698	0.0777	0.1204	0.0852	0.085
97202	"Ma allora mi direte: ""Come fare, Lorella?"	"""Il concetto di disuguaglianza non consiste solo nella disparità di reddito, ma soprattutto nella disuguaglianza di opportunità, di possibilità, di scelta, di libertà individuale."	1	0.0545	0.0881	0.073	0.0485	0.0683	0.071	0.0672	0.0849	0.0828	0.1185	0.0621	0.1138
39894	Solo due giorni prima ero in giacca e cravatta nell'ufficio della banca dalla quale mi sarei dimesso.	Avevo deciso di cambiare vita.	0	0.0406	0.0525	0.0613	0.0446	0.0498	0.0487	0.0613	0.0868	0.1009	0.1739	0.359	0.3742
100278	Diceva: alle bambine bisogna regalare il Meccano e una bambola.	Ma non perché tutte le bambine debbano diventare ingegneri: non succederà, questo.	0	0.0256	0.0331	0.036	0.0259	0.0275	0.0225	0.0213	0.0257	0.0405	0.0665	0.0883	0.1458
136474	Ecco perché naturale può anche uccidere, ed ecco perché artificiale, nel senso di manipolato dall'uomo, può salvare la vita.	Pensiamo ai diabetici: l'insulina che utilizzano è da anni prodotta da microrganismi geneticamente modificati per produrre insulina umana.	1	0.0327	0.0526	0.0387	0.024	0.0345	0.0302	0.0305	0.0292	0.0246	0.0302	0.0432	0.0746
195604	Questo tempo di percorrenza è dovuto principalmente ai sette passaggi via mare, che a tutt'oggi si possono attraversare soltanto con dei traghetti.	Pensiamoci un attimo.	0	0.0683	0.0975	0.0968	0.066	0.0688	0.0636	0.0844	0.1459	0.1891	0.2997	0.3472	0.3288
117735	Vi sembrerà una favola, ma è una storia vera.	Certo, mi rendo conto, ha i contorni della favola, ma è quello che è realmente accaduto.	0	0.0261	0.032	0.0278	0.0224	0.0248	0.0353	0.0344	0.0433	0.0458	0.0731	0.0552	0.0707
1966	Può ridare nerbo, energia a imprese, imprenditori e lavoratori, e può tornare a farci competere a livello internazionale.	Siamo gli unici che hanno come progetto un'economia animata dalla vita.	0	0.0298	0.0405	0.0587	0.0411	0.055	0.0526	0.0507	0.0738	0.0992	0.147	0.3562	0.2282
190023	La prima è sulla parola ageism.	Tanto che in Italia, l'abbiamo adattata con una forma terribile: ageismo.	1	0.0293	0.0471	0.0659	0.0484	0.0489	0.0439	0.0505	0.0672	0.0843	0.1026	0.0919	0.0624
48529	Parcheggio in fondo e vado a chiamare Andrea.	Suono, aspetto, sono in ritardo per cui lui si è già mosso da questa strada e ritorno all'auto.	0	0.0365	0.0499	0.0505	0.0406	0.0467	0.0533	0.0607	0.0976	0.1302	0.2104	0.5656	0.5474
1195	Sono tutti concetti parzialmente ambigui, è vero; ma la loro forza sta proprio nella loro astrazione, perché sono dei concetti ponte.	Con la loro grandissima quantità di manifestazioni differenti, sia attuali che potenziali, questi concetti ci ispirano perché ci mostrano che non dobbiamo mai rinchiuderci nella parzialità di un modo di vedere o di un'esperienza, che dobbiamo sempre guardare oltre, alla ricerca di nuovi punti di vista che ci permettano di scoprire relazioni nascoste con le cose e le persone che ci circondano.	0	0.0177	0.0359	0.0526	0.0393	0.0605	0.0564	0.0647	0.0739	0.0872	0.1091	0.2253	0.1849
8242	Una banca, generalmente, mi chiede degli interessi attivi, e quindi dovrò dare indietro anche degli interessi attivi.	È questo il senso di quello che devo fare: quindi non devo costruire un futuro migliore, ma devo costruire un mio presente migliore.	0	0.0206	0.0402	0.0336	0.0197	0.0275	0.0236	0.0212	0.0239	0.0293	0.0508	0.0458	0.0721
168168	Le borse e le valigie addirittura sono forse gli accessori funzionali per eccellenza, per definizione nascono proprio con la funzione di contenere e trasportare degli oggetti.	Nella preistoria erano i semi, nell'antica Grecia le monete, e così via.	0	0.0234	0.0445	0.0486	0.0408	0.0475	0.0473	0.0425	0.0566	0.0791	0.1261	0.1416	0.1957
59309	Imporre il nostro bisogno.	Ti senti un po' giù?	1	0.0674	0.0955	0.1056	0.0646	0.0655	0.0517	0.0666	0.0811	0.1332	0.1952	0.1594	0.1092
179496	Ci sono parti metalliche che collidono tra di loro, che collassano.	Dopo molto tempo, non ricordo quanto, è arrivata una piccola imbarcazione.	1	0.0234	0.0345	0.0447	0.0314	0.0438	0.0399	0.0385	0.0382	0.0476	0.0684	0.0818	0.1214
172554	È chiaro che richiedere che chi esercita il potere nelle aziende abbia delle figlie femmine non è una leva di policy purtroppo azionabile; non possiamo imporre ai top manager di riprodursi né di generare questi strani esseri di sesso diverso dal loro.	Quindi gli stereotipi fanno male davvero a tutti.	1	0.0457	0.0837	0.0871	0.0696	0.0753	0.0697	0.0712	0.0652	0.0714	0.0933	0.1526	0.17
155131	Io non vi so dire come sia andata quella storia.	La tecnologia vince sempre, il futuro vince sempre, è inutile cercare di fermarlo.	1	0.0354	0.0537	0.0486	0.0343	0.0416	0.0345	0.0344	0.0383	0.0324	0.0634	0.0481	0.0736
11713	"Io mi intestardisco e mi apro questi due siti, pensando di raddoppiare le possibilità di clienti e invece, in realtà mi arrivano delle mail che dicono: ""Guarda che c'è uno che hai tuoi stessi lavori, però ha un altro nome."	Ma chi è quello che ha fatto i lavori?	0	0.0306	0.0849	0.0936	0.0748	0.0789	0.0718	0.0726	0.0996	0.1107	0.1322	0.2443	0.262
149296	Ma non fidandovi l'uno degli altri, avete paura che possano imbrogliare.	Ad esempio ritagliando di nascosto le fiches o passandosele sotto il tavolo.	0	0.0284	0.0351	0.0626	0.0413	0.043	0.0427	0.0416	0.0686	0.1054	0.1436	0.3119	0.3779
116358	Il luogo da cui si proviene, in cui si è nati e cresciuti, e i luoghi in cui ci siamo sentiti a casa.	Questo da un punto di vista emozionale è chiaramente difficile perché richiede di stare in un posto per un periodo abbastanza lungo ma viaggiare anche moltissimo, richiede passare tempo con le persone vicine, ma essere vicino alle persone lontane.	0	0.023	0.0338	0.0246	0.0191	0.0229	0.0268	0.033	0.0348	0.0459	0.0728	0.0756	0.095
127670	C'era una volta, tanto tempo fa, una vedova che aveva due figlie bruttine e anche un po' antipatiche.	C'era una volta una bella principessa di nome Biancaneve.	0	0.0146	0.0277	0.0279	0.0282	0.0242	0.0256	0.0284	0.0239	0.02	0.0196	0.0258	0.0717
100479	Una persona deve saper piangere ed è importante piangere.	Viviamo il mondo diversamente.	1	0.0358	0.0288	0.0325	0.0204	0.032	0.0337	0.0512	0.0704	0.0949	0.3024	0.503	0.5427
19315	Perché le macchine sono molto più forti di noi.	Ma ricordiamoci una cosa, e ricordiamocela in maniera molto forte e ricordiamocela in modo molto preciso: siamo solo noi, esseri umani, capaci di porre le domande giuste nel momento giusto.	1	0.0435	0.0727	0.0775	0.0587	0.0691	0.0777	0.0716	0.0851	0.091	0.1259	0.0909	0.1378
93626	Cresciamo, quindi, questi bambini maschi anche loro nella loro gabbia di stereotipi di mascolinità.	Li mandiamo a scuola, poi vanno al lavoro e ci aspettiamo che siano il motore economico della famiglia.	0	0.0264	0.0286	0.0201	0.0142	0.0182	0.0178	0.017	0.0218	0.0364	0.0892	0.178	0.2197
103267	Poi ci sono anche quelli che vengono utilizzati per altri scopi.	È uno sterminio quotidiano e annuale.	0	0.0345	0.048	0.0451	0.0339	0.0473	0.0445	0.0448	0.0468	0.0616	0.087	0.0736	0.0914
186985	Se la strategia che privilegi quando le cose non vanno come vorresti, è quella di lamentarti, presupponi che qualcuno sia allo studio di un piano B per salvarti la pelle.	Possiamo manipolare a nostro piacimento ciò che ci circonda.	1	0.0293	0.0429	0.0404	0.0316	0.0349	0.0416	0.0414	0.0504	0.0578	0.083	0.3744	0.4315
133890	Ma se lo possono permettere perché i loro clienti sono i più fedeli del mercato.	Se io chiedo alla gente di non comprare i miei prodotti, come posso vendere il 10% in più dei miei prodotti ogni anno?	1	0.0206	0.0561	0.0505	0.0338	0.0348	0.0323	0.0297	0.0271	0.0261	0.0509	0.0983	0.1438
124963	Cosa vuol dire?	E allora, l'idea di accompagnare l'ho presa proprio da alcune famiglie, che pur non conoscendosi hanno ripetuto lo stesso concetto.	1	0.0722	0.1428	0.1347	0.0858	0.0872	0.0873	0.1044	0.1653	0.2223	0.2914	0.2377	0.137
164522	In particolar modo, grazie a questi quattro dispositivi, proprio nel 2010, nel mio libro, avanzavo l'ipotesi di poter leggere questo cavaliere automatico come un tamburino, quindi vale a dire un musico, dotato di un tamburo melodico, che potesse in qualche modo scandire il ritmo delle feste e dei balli, ma anche le entrate ufficiali alla corte degli Sforza.	E quindi, pertanto, si assiste a una sorta di vero e proprio parallelismo tra gli organi come ingranaggi e il corpo come macchina.	1	0.0159	0.0396	0.0475	0.04	0.0496	0.046	0.0535	0.0561	0.0817	0.0984	0.2069	0.1294
44133	Questo è quello che per me significa vivere.	Qual è la vostra prima reazione, davanti a un'immagine come questa?	0	0.0279	0.0504	0.0728	0.0511	0.059	0.0573	0.0565	0.0757	0.0879	0.1103	0.1408	0.121
36535	Dalla testa uno ricava in qualche maniera le orecchie, e poi la cosa bella è come si forma la testa.	Adesso qui serve uno zoom proprio su questa parte.	0	0.037	0.0693	0.0698	0.046	0.0537	0.0535	0.0549	0.0652	0.0459	0.0521	0.0614	0.1079
154695	E intanto il mare sale, il mare sale, si fa sempre più scuro, e il sole cala all'orizzonte.	Siamo completamente inzuppati.	0	0.0479	0.0721	0.0694	0.0502	0.0597	0.0654	0.0613	0.1008	0.1063	0.147	0.1328	0.084
137937	Condividerò con voi, in diretta, i risultati, e vediamo se siete stati bravi o no.	Perché l'idea di intelligenza della folla nasce più di 100 anni fa.	0	0.0257	0.0565	0.058	0.0422	0.0462	0.0453	0.0436	0.057	0.0929	0.1224	0.1563	0.1578
44809	subì l'asportazione di entrambi gli ippocampi per trattare una forma molto grave di epilessia, più o meno negli anni '50.	Bensì ci permette di acquisirne di nuove.	1	0.0389	0.0716	0.0676	0.045	0.0515	0.0527	0.057	0.0838	0.1039	0.146	0.1664	0.2045
43826	Ok, e cos'hanno inventato negli autogrill?	De Bono ha formalizzato il pensiero laterale e l'ha formalizzato partendo da un presupposto: il cervello non è fatto per essere creativo.	1	0.0322	0.0667	0.0617	0.0484	0.0472	0.0442	0.043	0.0436	0.0358	0.0421	0.082	0.1227
98778	Queste sono le tante, troppe costrizioni a cui noi creativi pubblicitari ogni giorno guardiamo.	Nel preparare l'intervento di stasera mi sono trovato a scrivere questa parola perché riflettevo sui confini e sui perimetri di questo mestiere.	1	0.0247	0.0461	0.0514	0.0372	0.0435	0.0444	0.0504	0.0606	0.0818	0.1088	0.1107	0.0989
1918	Facciamo degli Street View di sentieri, ossia degli ambienti virtuali all'interno dei quali ci si può muovere avanti e indietro lungo un percorso, visti dalla prospettiva di qualcheduno che effettivamente sta camminando.	Poi dopo oltre a questo abbiamo aggiunto dei contenuti che raccontano quello che nascondono questi luoghi, parliamo di geologia, di storia, di letteratura, di arte, di antropologia, e quindi il tutto diventa una sorta di documentario interattivo che è poi pubblicato gratuitamente su un sito che si chiama trailmeup.com.	0	0.0161	0.0426	0.0474	0.0587	0.1022	0.1467	0.1739	0.1774	0.1592	0.2202	0.2391	0.2324
92359	Ma sembrano anche domande facili: Che cosa esiste?	La realtà, facile.	0	0.0442	0.0408	0.0805	0.0523	0.0593	0.0708	0.0817	0.0904	0.1442	0.31	0.6545	0.4162
132701	"Ricordo Antonio, un signore di mezza età che al termine della sua degenza venne a salutarmi e mi disse: ""Sa dottoressa, in questo periodo di ospedale ho capito che la cosa più difficile da fare quando andrò a casa, non sarà smettere di fumare o prendere tutte queste medicine, ma imparare ad amare la vita."	Nelle storie dei pazienti che incontravo in ospedale mi rendevo conto che c'era un filo conduttore, un filo rosso, che si può chiamare mancanza d'amore, di amore per se stessi.	0	0.0145	0.0379	0.0441	0.0306	0.0413	0.0409	0.0451	0.0572	0.0455	0.0657	0.1792	0.1703
172378	Ma perché non cambiare?	Quindi abbiamo pensato di istituire un marchio, un marchio per dei locali che all'estero utilizzino prodotti italiani o che all'interno abbiano degli italiani di prima o di seconda generazione.	0	0.0738	0.1205	0.1102	0.0733	0.0808	0.0716	0.0786	0.105	0.1226	0.2011	0.3095	0.1727
48604	Quindi non è invasiva, non è intrusiva, è una matematica virtuale, è un approccio individuale fatto con carta e penna e computer naturalmente, ma nei laboratori scientifici quindi non abbiamo bisogno di acquisire nuove indagini e quindi ovviamente essere più di impatto dal punto di vista personale, dal punto di vista sociale ed economico, sul paziente.	È una matematica predittiva.	0	0.0571	0.1206	0.1277	0.1047	0.1479	0.1488	0.1661	0.1614	0.1413	0.1894	0.1297	0.125
22500	Cosa potrà fare lo Sportsystem?	Di sicuro chi si deve muovere avrà bisogno di oggetti leggeri, di oggetti che siano facilmente igienizzabili, e soprattutto avrà bisogno, in una città smart dove l'Internet of things, cioè l'internet delle cose, le cose che parlano tra di loro e che parlano con te, dove l'Intelligenza artificiale sarà dominante, avranno bisogno di avere la Wearable Technology, la tecnologia indossabile, che è esplosa in una maniera incredibile.	0	0.0535	0.11	0.1147	0.0804	0.0835	0.0976	0.1187	0.167	0.2031	0.3079	0.4855	0.539
181454	Quello è un ingegnere elettrico, collega i fili, infatti vedete che sono colorati i fili elettrici.	In un circuito elettrico non ha importanza la distanza fra due punti, hanno importanza le giunzioni.	0	0.0288	0.038	0.0268	0.0255	0.033	0.0315	0.0315	0.0305	0.034	0.0446	0.0507	0.1153
110548	Fa quello che gli dicono gli altri, o sennò perde tutto il suo spirito critico e assume quello della maggioranza delle altre persone.	Questa è una cosa che per noi è assolutamente evidente quando parliamo ad esempio del web, di internet, dei social network.	0	0.0313	0.0394	0.0298	0.0213	0.0211	0.0176	0.0178	0.0268	0.0328	0.0576	0.0314	0.0888
79643	E dei colleghi delle terapie intensive tempo fa avevano detto: ma se non parlano curiamo meglio il corpo.	Abbiamo citato la sigla e l'hai appena accennata un po', ma CAA che cos'è?	1	0.026	0.0383	0.0668	0.0466	0.0472	0.0393	0.0429	0.049	0.0788	0.107	0.1999	0.1333
34416	I mariai erano diversi dagli altri uomini.	Ma i marinai di più.	1	0.0294	0.0333	0.0329	0.028	0.0389	0.045	0.042	0.0541	0.0729	0.1209	0.2687	0.3783
7755	Altrimenti, il rischio è di mantenerli solo per sé, e continuare a iterare nel tentare di perfezionare un oggetto e alla fine non presentarlo mai al mondo.	La mia sfida è proprio crescere passando all'oggetto successivo passando al progetto successivo.	0	0.0222	0.0432	0.046	0.0342	0.0315	0.0406	0.0426	0.0576	0.0829	0.1118	0.1033	0.0939
49252	E hanno scoperto che i bambini bilingue sono molto più capaci dei monolingue di mantenere focalizzata l'attenzione.	Si sono chiesti come mai, e la risposta è questa: di fatto, ogni volta che un bambino bilingue deve affrontare la realtà ha sempre almeno due etichette, due parole, che possono essere utilizzate.	0	0.0158	0.0255	0.0428	0.0342	0.0382	0.0405	0.044	0.0491	0.0627	0.0699	0.0962	0.171
138986	Mi dicono che in teatro ci sono circa 800 persone, per cui siete attorno al 10 - 15%.	Perché non 50 e 50?	1	0.0429	0.0666	0.0857	0.0552	0.0639	0.0639	0.0792	0.1063	0.1462	0.1521	0.0855	0.1535
194092	Aprii la porta della scuola per far passare due ragazze che mi guardano e sorridono.	"Perché ogni singolo fidanzato, amante, candidato, a questo punto aveva un problema: ""Oh, Paolo is so cute! """	1	0.0338	0.0522	0.0607	0.0404	0.0522	0.0506	0.0566	0.0778	0.0719	0.0854	0.0897	0.1225
189625	Non so se vi è mai capitato di stare a letto di non avere la forza di andare al lavoro o di vedere degli amici.	Quindi la domanda è: come gestire questa energia negativa che proviamo?	0	0.0279	0.0369	0.0358	0.0277	0.0341	0.033	0.0455	0.0582	0.0655	0.0967	0.2626	0.3169
