Id	Sentence_1	Sentence_2	Class	Cosine_distance_layer_1	Cosine_distance_layer_2	Cosine_distance_layer_3	Cosine_distance_layer_4	Cosine_distance_layer_5	Cosine_distance_layer_6	Cosine_distance_layer_7	Cosine_distance_layer_8	Cosine_distance_layer_9	Cosine_distance_layer_10	Cosine_distance_layer_11	Cosine_distance_layer_12
91512	Creando una rete basata su sperimentazione e condivisione possiamo far sì che, da tanti casi isolati, possa partire una rivoluzione educativa dal basso.	Quando si inizia a fare vela, normalmente ci si lascia trascinare dal vento e si segue la direzione del vento.	1	0.0287	0.0423	0.0315	0.026	0.0255	0.0216	0.0191	0.0236	0.0297	0.0505	0.0414	0.0533
44873	Ecco: fu la fascinazione, scaturita da quella visione, a cambiare tutti i miei progetti.	E cominciai a desiderare, da quel momento, di poter essere accolta da una carovana, una carovana del sale.	0	0.0168	0.03	0.0228	0.0173	0.0284	0.0338	0.0342	0.0451	0.0646	0.1001	0.1049	0.1283
135701	Sergio ci ha appena detto: portiamoci due sacchetti, quando andiamo a fare il bagno.	Coinvolgiamo i nostri amici.	0	0.043	0.0546	0.0526	0.0404	0.0488	0.0668	0.0674	0.0752	0.1126	0.1492	0.3859	0.3145
93612	Perpetua è una vera e propria re - evoluzione, perché per la prima volta abbiamo fatto qualcosa che prima non esisteva: abbiamo fatto del self - cycling!	Il self - cycling consiste nell'autoconsumare lo scarto, quindi chi usa Perpetua ricicla e consuma, scrivendo, 15 grammi di grafite.	0	0.0163	0.0481	0.0465	0.0322	0.0298	0.0303	0.0313	0.0475	0.0557	0.0661	0.1437	0.1242
198914	All'inizio, quando sono arrivati i primi gruppi di migranti dal sud Italia, un pezzo del quartiere è diventato una centrale operativa di primo soccorso in cui era disponibile tutto: dai vestiti al cibo, ai medicinali.	Vi faccio un esempio di partecipazione attiva.	1	0.0421	0.0757	0.0725	0.0633	0.0714	0.0724	0.0762	0.0972	0.1414	0.1877	0.3068	0.3015
86245	Divento uno dei portabandiera di questo brand, che scatenava una reazione euforica nelle persone a livello globale, tant'è che è difficile descrivervi la passione con cui vivevo ogni giornata.	Ed effettivamente poi le possibilità di carriera arrivano, perché nel 2012 divento Senior Manager in Germania.	0	0.0285	0.041	0.0428	0.0371	0.0432	0.0481	0.0565	0.0678	0.0977	0.1584	0.4792	0.6165
116983	Ma che bella cosa!	Che bella cosa!	0	0.0125	0.0107	0.013	0.0095	0.0109	0.0074	0.0098	0.0086	0.0065	0.003	0.0021	0.0378
151944	"Alla madre appare una notifica: ""Tua figlia ti ha mandato 10.000 pesos."""	Lei non deve conoscere Bitcoin.	0	0.0356	0.0578	0.0509	0.036	0.0483	0.0481	0.0491	0.0555	0.0601	0.0845	0.1275	0.1644
130975	E allora, a questo punto, arriva il momento di confrontarsi.	Arriva il momento di aprirsi a un gruppo di riferimento.	0	0.0135	0.0239	0.0211	0.0166	0.0171	0.0191	0.0175	0.021	0.0299	0.0486	0.1314	0.1153
55116	Distribuzione Questa è la curva dell'andamento della diseguaglianza di reddito tra i cittadini del mondo.	Come possiamo leggere questi dati?	1	0.0591	0.0676	0.0606	0.0406	0.0716	0.0761	0.0671	0.0854	0.0926	0.1589	0.3156	0.4397
64338	Ma il legno, poi, ci ha dotato di un'altra cosa: della carta.	La carta che è stata il supporto delle idee dell'uomo, il supporto della cultura.	0	0.0151	0.0218	0.0228	0.0139	0.0139	0.0119	0.0135	0.0129	0.0126	0.0246	0.1286	0.1419
111525	Altrimenti, correggerli, adattarli per arrivare in sintonia.	E in effetti è proprio un po' così.	0	0.0376	0.046	0.0561	0.036	0.0362	0.0286	0.0311	0.0487	0.0597	0.1146	0.1295	0.2029
79089	Ma neanche per sbaglio!	Eravamo dappertutto.	1	0.0564	0.0545	0.049	0.0405	0.0464	0.0539	0.0676	0.0918	0.2513	0.4311	0.1133	0.2578
46869	Voleva sistematizzare e ricomporre il sapere tramite una ricostruzione microcosmica del macrocosmo.	"A un certo punto scrive, con un certo orgoglio: ""Oggi nel mio microcosmo si possono vedere il numero di 18.000 cose diverse, veramente esemplari delle specie prodotte dal grande Iddio""."	0	0.0318	0.0507	0.0526	0.0436	0.0606	0.0563	0.0649	0.0735	0.1272	0.198	0.1252	0.0979
11977	Anzi, vorrei togliere, se me lo concedete, quel sapore moralistico dalla parola 'individualista'.	Perché è una parola che ci richiama qualcosa di negativo, come se fosse qualcosa di brutto già appunto a sentirlo dire, e spesso è utilizzato così.	0	0.0242	0.0432	0.051	0.0331	0.0286	0.0293	0.0295	0.0396	0.0476	0.0659	0.1455	0.214
99665	L'Europa non dà una risposta legale alternativa al siriano che è costretto a spendere euro 10.000 per esercitare un diritto riconosciuto dalla legge internazionale e italiana: si chiama diritto d'asilo.	Non c'è una risposta istituzionale: c'è un vuoto riempito dal crimine.	0	0.0218	0.0308	0.0395	0.0294	0.032	0.0331	0.0367	0.0297	0.0224	0.0256	0.0325	0.0446
164554	Vediamo un esempio: il Dharma, questo qui a destra, è un talismano di buona sorte, protezione, proveniente dal buddhismo.	Allora, se sono lo specchio dell'uomo, evidentemente, come abbiamo visto in precedenza, parlando di cultura, dobbiamo considerare la nostra cultura, il nostro passato, nel modo in cui li disegniamo.	1	0.0157	0.035	0.044	0.0394	0.0416	0.04	0.0366	0.0512	0.0685	0.0769	0.1208	0.1544
137506	Perché il vincolo più grosso è quello sul rumore Esisteva un servizio di aerotaxi che da JFK, l'aeroporto di New York, portava nel centro di Manhattan, ma questo servizio è stato chiuso non per attentati, problemi legati alla sicurezza, ma per un semplice motivo: chi lavorava nei dintorni di questo eliporto, che era posto sulla cima di un grattacielo, lamentava il rumore di questi voli, che erano abbastanza rari.	Noi abbiamo fatto questa scelta perché?	1	0.0701	0.0844	0.0823	0.0619	0.0769	0.1044	0.1143	0.1643	0.2072	0.3148	0.5661	0.5227
68849	La fotografia mi ha insegnato tante altre cose.	Oggi, se sono qua, non è per dirvi cosa dovete o dovreste fare.	1	0.0386	0.0393	0.0455	0.0324	0.0404	0.0381	0.0368	0.0404	0.0532	0.08	0.1092	0.1977
148486	Uno di questi è l'approccio cognitivo: si basa sul pensiero umano.	Probabilmente molti di voi hanno sentito parlare del sillogismo di Aristotele.	1	0.0265	0.0307	0.0545	0.0404	0.0346	0.0336	0.0285	0.0482	0.084	0.1382	0.268	0.2897
114889	L'Europa ferma i barconi, e loro si inventano gli yacht di lusso.	E offrono servizi su misura.	0	0.0362	0.0484	0.0733	0.0586	0.0649	0.0573	0.0581	0.0818	0.1018	0.151	0.2152	0.4194
183540	Vodafone non vendeva nessun prodotto in Africa e in India, perché in questi paesi la gente non paga il telefonino.	Un telefonino che funzioni, un detersivo che lava, eccetera.	1	0.0342	0.0483	0.052	0.0301	0.0324	0.0328	0.0407	0.0545	0.068	0.0793	0.0928	0.1229
176888	Nel 1470 un gelato al tamarindo?	È una domanda a cui bisogna darsi una risposta.	0	0.045	0.0468	0.0473	0.0367	0.0482	0.0532	0.0514	0.057	0.0725	0.0927	0.0821	0.1218
74960	Ora ve le leggo.	"""Talking Hands aiuterà le persone sorde a uscire dal silenzio, permettendo loro una prima forma di comunicazione anche con chi non conosce la lingua dei segni."	0	0.0647	0.0867	0.1181	0.0756	0.0838	0.096	0.0989	0.1137	0.1045	0.1593	0.2304	0.3367
195659	Ora, TED sono idee che vale la pena condividere: io ho cercato di fare il meglio condensando, individuando tre idee che in questi anni di studio e di lavoro in questo settore ho trovato molto interessanti, col più grande potenziale, e voglio condividerle con voi.	La prima è appunto quella del credito mutuale, che abbiamo appena citato.	0	0.0307	0.0585	0.0529	0.042	0.0472	0.0526	0.0707	0.1263	0.2209	0.4014	0.4685	0.4461
82276	Quindi mi sono fermamente decisa a farlo accadere anche miei studenti.	Un progetto che potesse essere una specie di palestra di vita per i miei ragazzi.	1	0.0266	0.0266	0.0265	0.0241	0.0262	0.0372	0.0352	0.0397	0.0443	0.0695	0.2728	0.3048
162840	O raccontare di come Leah Busque, la fondatrice di TaskRabbit, abbia dovuto cambiare il business model della sua azienda decine di volte, litigare con gli utenti inferociti, col CdA, dimettersi da CEO dell'azienda ma poi, alla fine, riuscire a vendere la sua azienda a IKEA e rivoluzionare un settore intero.	Cosa hanno in comune queste quattro storie?	0	0.0585	0.1517	0.152	0.1123	0.1191	0.1116	0.1123	0.124	0.1172	0.1639	0.2707	0.2575
45903	Bene, immaginate che cosa possa accadere se questo gesto assume la dimensione urbana.	E invece io penso che oggi noi dobbiamo capire il presente per capire la storia.	1	0.0174	0.0404	0.029	0.0202	0.0245	0.0237	0.0229	0.0257	0.0397	0.0948	0.1502	0.1694
16552	Ma che cosa vi aspettavate?	Che io venissi qui a suonarvi qualche cosa, o a descrivervi come funziona una sinfonia?	0	0.0385	0.052	0.0545	0.0363	0.0477	0.0529	0.0531	0.0573	0.0775	0.1208	0.0877	0.1144
187700	Gli piacevano le code, le file, gli piacevano gli orologi a pendolo, gli specchi perché lavorano con zelo.	Lui era di origine ebrea e però non credeva negli aspetti strettamente religiosi dell'ebraismo.	1	0.0391	0.0726	0.0637	0.0439	0.0344	0.0303	0.0281	0.0418	0.0534	0.0716	0.0947	0.142
120437	In realtà ricordo anche bene come al rientro, dopo qualche settimana, mi resi conto di quanto fossi lontano dal mio obiettivo, lontano dall'oggetto che volevo realizzare.	Spesso sono diversi da come ce li eravamo aspettati all'inizio, da come ce li eravamo immaginati, ma questa fa parte della magia del processo creativo.	1	0.014	0.0346	0.0257	0.0179	0.018	0.016	0.0155	0.0123	0.0091	0.0111	0.0695	0.1056
145447	Ho viaggiato quindi dal nord della Norvegia, da Narvik, e sono sceso fino a Pozzallo nel sud della Sicilia.	Mi sono reso conto però che il titolo che mi ero immaginato Almost Europe - Quasi Europa si adatta bene sia all'Europa dell'est nel suo essere sempre in bilico tra Comunità Europea e Federazione Russa che all'Europa dei 28, sempre alla ricerca di un'identità.	1	0.0227	0.0413	0.0632	0.0413	0.04	0.0356	0.0492	0.0887	0.1095	0.1205	0.3358	0.4375
193888	Cosa potrò dare mai a questo popolo?	Sempre quello, ma per dire - per dire cose che non c'entravano niente: 'Ehi, ciao! ' Ma come?	1	0.0323	0.0581	0.0956	0.0574	0.072	0.0702	0.0791	0.104	0.1386	0.1691	0.1613	0.1757
23459	Altrimenti, il rischio è di mantenerli solo per sé, e continuare a iterare nel tentare di perfezionare un oggetto e alla fine non presentarlo mai al mondo.	Ma è proprio lì che vi sfido a cercare le vostre passioni, ad analizzarle, a cercare le vostre idee, trattarle con cura, trasformarle in progetti, quindi in prototipi e quindi in oggetti.	1	0.0118	0.02	0.0178	0.0127	0.0154	0.0147	0.0176	0.0215	0.0374	0.065	0.0925	0.0574
66843	Può essere vero.	Ovviamente, la dipendenza dai videogiochi è una cosa seria.	0	0.0606	0.0683	0.069	0.042	0.059	0.0572	0.0667	0.0659	0.0997	0.1448	0.126	0.235
187907	Bisogna anche divertirsi.	"E allora, ""Technology""."	0	0.0742	0.0818	0.0723	0.0484	0.0497	0.0465	0.0579	0.0601	0.0792	0.2211	0.6263	0.2392
113889	Quando il corpo inizia a dolerci e dolerci, smonta di turno alla chetichella, è schifiltosa, non le piace vederci tra la folla.	Il nostro lottare per un vantaggio qualunque e lo strepito degli affari la disgustano.	0	0.0246	0.0334	0.0314	0.0217	0.0235	0.0267	0.0292	0.0392	0.0322	0.0409	0.1476	0.3087
133128	E sono sicuro che molti di voi conoscono la più basilare interazione intermolecolare, che è quella su cui è basata la vita, che è il legame a idrogeno, ed è proprio l'interazione elettrostatica utilizzata dalle molecole di acqua che si auto - assemblano in maniera perfettamente direzionale e geometrica, per poi costituire e risultare nell'acqua che beviamo, che è liquida a temperatura ambiente, ma che al di sotto degli zero gradi centigradi porta a queste bellissime strutture geometriche perfettamente organizzate, come quella del cristallo di neve.	Però si scoprono quotidianamente nuove interazioni intermolecolari, e mi fa piacere poter citare un'interazione intermolecolare che è stata scoperta qui al Politecnico.	1	0.0257	0.0518	0.0428	0.0274	0.0342	0.034	0.0466	0.0429	0.0317	0.0348	0.0434	0.0903
161246	It's time to rock!	Ecco perché dobbiamo oggi capire da dove viene questo problema e, con tanti anni di ricerca scientifica, si è individuato il fattore che non funziona, e questo fattore è il fatto che i 200 anni di Rivoluzione Industriale, che ci hanno dato tanta prosperità e ci hanno portato alla straordinaria quantità di mezzi tecnologici di cui disponiamo, non erano gratis.	1	0.0746	0.103	0.1031	0.0657	0.0738	0.1056	0.1293	0.1487	0.1682	0.2453	0.3419	0.2867
17972	Io capii che gli Stati Uniti si occupavano, soprattutto, della interpretazione fisica del fenomeno.	E io, sfruttando le mie conoscenze matematiche, avrei potuto formulare modelli per calcolarlo.	0	0.022	0.0385	0.0424	0.0255	0.0216	0.0237	0.0218	0.024	0.039	0.0512	0.1166	0.1566
49194	Però, nonostante la sua globalità, si focalizza sulla località, sull'ecosistema locale.	Non dobbiamo far altro che dargli i super poteri, io dico, e i super poteri vengono dalla società nella quale viviamo, nell'ecosistema.	1	0.0226	0.0415	0.0413	0.0226	0.0237	0.0194	0.0205	0.0154	0.0109	0.0126	0.0699	0.1038
29949	"""Ah, mi avrebbe amato, mi avrebbe dato del bene, se invecchiava tra noi."	Giada, di 17 anni.	1	0.0332	0.055	0.0566	0.0469	0.0519	0.046	0.0498	0.0515	0.071	0.1202	0.3329	0.311
77357	Ed è una scintilla che ci dà la vita in ogni secondo.	Queste capacità di sintesi e di aggregazione concettuale è quello che fa della matematica uno strumento assolutamente potente e vorrei dire unico.	1	0.0241	0.0426	0.0367	0.0303	0.0366	0.0397	0.0387	0.0391	0.0414	0.0592	0.1027	0.0884
14122	La difficoltà di collegarsi, una città non accessibile è una città che non dà diritti.	Dovremmo essere sicuramente i primi, se poi andiamo a vedere quanto i palermitani amano andare in macchina.	1	0.0315	0.0459	0.0344	0.0226	0.0321	0.0349	0.0312	0.0343	0.0442	0.0568	0.0804	0.1369
33704	Ormai è stranota l'importanza che hanno i microbi che albergano l'intestino umano, e quello di tanti animali - di tutti gli animali!	Ma forse non sapete quanto siano importanti i microbi che vivono all'interno delle radici delle piante.	0	0.0124	0.0238	0.0341	0.022	0.0251	0.0229	0.0268	0.0233	0.0222	0.0189	0.0444	0.0796
58977	E ad onor del vero, d'inciampi in quei primi tre anni di attività, se ne presentano parecchi.	Anzitutto l'esercito, dal quale avevano ottenuto l'hangar di cui vi ho parlato, che dopo pochi mesi rivuole l'hangar e il campo, di fronte.	0	0.0174	0.0254	0.0309	0.0233	0.0232	0.0216	0.0264	0.0234	0.018	0.0185	0.0659	0.1103
5748	E quando deve riprodursi, sceglie uno delle decine di vulcani che si trovano per esempio a Oakland - centinaia, forse migliaia, in tutta la Nuova Zelanda - e va in cima a questa collina.	Quello che mi colpisce particolarmente, della Nuova Zelanda, è la biodiversità e le caratteristiche della fauna.	1	0.0164	0.0292	0.0405	0.0329	0.0401	0.0364	0.0359	0.0391	0.0471	0.0545	0.1384	0.2002
138935	Un raggio di luce, sulla sua superficie, resta lì.	Insieme: Andiam, andiam mio bene, a ristorar le pene, di un innocente amor.	1	0.0286	0.0477	0.0389	0.0314	0.0356	0.0408	0.0398	0.0484	0.0514	0.078	0.0757	0.0814
74952	Utilizziamo, anche se non si tratta solo di elaborazioni speculative, si tratta anche di realizzare modelli che rispondono - come in questo caso, utilizzando un Arduino, a queste ipotesi di progetto.	Possiamo capire come si espande, e quindi possiamo capire quali sono le tendenze di questi organismi di riassettarsi e allo stesso tempo possiamo anche capire come si può utilizzare direttamente questo materiale come un materiale per le costruzioni.	1	0.0153	0.0257	0.0243	0.0167	0.0181	0.0175	0.0219	0.0329	0.048	0.0625	0.0652	0.1054
121422	Però è successa nel frattempo qualcosa che ha reso il DNA una cosa molto diversa.	È successo questo.	0	0.0429	0.0547	0.0966	0.0634	0.0691	0.0639	0.0703	0.0891	0.1283	0.1796	0.3304	0.3252
72678	Siamo appena arrivati e ci sembra di vivere in un sogno.	Subito dopo abbiamo una fase di grande entusiasmo.	0	0.0224	0.0291	0.0258	0.0201	0.0243	0.0238	0.0225	0.021	0.0331	0.0613	0.0464	0.07
156814	L'altra parola, 'Invenzione', anche questa di origine ovviamente latina, da 'invenire', cioè trovare, cercare e trovare.	Che cos'è?	0	0.0591	0.1242	0.1121	0.08	0.084	0.0723	0.104	0.1126	0.0791	0.0815	0.0873	0.1644
134197	Ha fatto un concorso internazionale che è stato vinto da Matteo Bartoli e Michele Pastore il quale ha portato a una soluzione diversa.	dalle soluzioni usuali che abbiamo già visto.	0	0.0359	0.0659	0.0537	0.0359	0.04	0.045	0.0484	0.0704	0.0884	0.1065	0.1559	0.1712
197121	"La prima è quella che rispetta le proporzioni del corpo umano e che il nostro cervello riconosce come ""perfette""."	Quindi la bellezza è dentro ognuno di noi.	0	0.0315	0.0378	0.0333	0.0313	0.0397	0.0527	0.0501	0.0782	0.1299	0.1948	0.1463	0.162
129835	Viene restituito in dieci anni, ha un pre - ammortamento di 24 mesi più sei mesi, ed è ad interessi zero.	Cambiare mi è costato molto caro.	1	0.0474	0.0674	0.0656	0.0483	0.0484	0.0499	0.0581	0.0965	0.0943	0.127	0.2407	0.5071
161346	Un formicaio: questo erano le Alpi alla fine dell'Ottocento.	Brulicavano di persone sui versanti al sole e persino su quelli in ombra su quelli dei pendii più dolci e su quelli più ripidi e più rocciosi.	0	0.0264	0.0493	0.0387	0.0293	0.0317	0.0369	0.0381	0.0564	0.0818	0.1079	0.3052	0.199
167610	"Un amico mi diceva, l'altro giorno: ""Gli aerei - i robot sono come degli aerei 747, che ci possono portare da una parte all'altra del pianeta in poche ore."	"Ma non saranno mai in grado di atterrare su un albero""."	0	0.0253	0.0342	0.0478	0.0435	0.0463	0.0436	0.053	0.0766	0.1226	0.178	0.1664	0.356
153526	Potevamo iscriverli a una sezione speciale, come si fa spesso con le persone disabili.	Certo, avremmo vinto di sicuro: erano gli unici due pizzaioli disabili!	0	0.0214	0.0434	0.051	0.0384	0.0412	0.0459	0.0439	0.0525	0.0488	0.0808	0.0589	0.0867
47060	Dei signori, a Washington, tracciarono una linea retta, così, in mezzo al deserto, perché gli serviva la pianura per fare la ferrovia.	ai migliori ospedali.	1	0.0622	0.0949	0.0916	0.0609	0.0724	0.0801	0.0987	0.152	0.1956	0.2168	0.2365	0.23
35708	Questo avviene a vent'anni esatti dalla prima massiccia immigrazione italiana in quel Paese.	"E così mi trovo a 2000 metri di quota all'inizio dell'ultima discesa che oramai è il crepuscolo, quell'ora incerta che i francesi oltre il confine chiamano ""entre chien et loup"", tra cane e lupo perché con la luce così fioca è difficile distinguere nettamente la sagoma dell'uno dalla sagoma dell'altro."	1	0.0238	0.0546	0.0423	0.0351	0.0427	0.0524	0.0717	0.0629	0.0483	0.0461	0.0595	0.0931
157114	Fatemi fare un altro esempio.	Io ora vedo - quello che riesco, con queste luci, vedo tutti i vostri visi.	0	0.0385	0.0546	0.073	0.0536	0.0581	0.0655	0.0723	0.0849	0.0965	0.2246	0.2036	0.3287
51852	Per gli altri, purtroppo, li lasciamo alle nostre spalle.	Le aziende responsabili e sostenibili sono aziende che fanno più soldi degli altri?	0	0.0238	0.0345	0.0465	0.0385	0.0414	0.0476	0.047	0.0457	0.049	0.0992	0.1415	0.2621
107573	Noi invece li faremo in Italia con alta qualità.	Tutti vanno alla ricerca di economie di scala per mantenere il prezzo basso: riga!	1	0.0276	0.0525	0.0592	0.0533	0.0694	0.0652	0.0603	0.0627	0.0547	0.0824	0.1306	0.1311
184815	Questo è lo spartiacque dal periodo di dilettante a quando sono diventato professionista.	È stato un periodo molto fertile.	1	0.0447	0.0467	0.0499	0.0394	0.0471	0.0469	0.0503	0.0627	0.0684	0.0909	0.0564	0.0797
158295	Quindi noi abbiamo dentro - 50 anni fa, oggi, e speriamo anche fra 50 anni, una naturale propensione ad imparare.	Questa è una vocazione, una sorta, - come dire - di orientamento di fondo che noi abbiamo.	0	0.0151	0.0224	0.0184	0.0139	0.0183	0.0185	0.0187	0.0228	0.0286	0.0382	0.0553	0.0664
93523	Ogni volta che la Terra fa un giro intorno al Sole è passato un anno, evidentemente.	La traiettoria bianca è la traiettoria di Rosetta, all'interno del nostro sistema solare.	0	0.022	0.0328	0.03	0.0193	0.0218	0.03	0.031	0.0509	0.0827	0.1146	0.228	0.2139
51978	La radio cambia i paradigmi di un Paese.	Questa è la differenza della radio: arriva dove gli altri media non arrivano, perché non ha solo uno scopo commerciale.	0	0.0317	0.0434	0.0484	0.0393	0.0386	0.0397	0.038	0.0523	0.0567	0.072	0.1001	0.1059
195870	Allora mi sono chiesto: potrà essere la mia startup, tra 15 anni, mi auguro, un'azienda consolidata ad attrarre le nuove generazioni?	Significa che, nella scelta tra l'uovo oggi e la gallina domani, tu punti tutto sul pollaio che, se tutto andrà bene, costruirai e popolerai tra qualche anno.	1	0.0177	0.0301	0.0296	0.0219	0.0203	0.0247	0.0241	0.0197	0.0137	0.0138	0.0307	0.0786
20850	Vi parlerò della reciprocità della coppia.	Avete mai pensato, provato ad avere più di una relazione di coppia nello stesso momento?	1	0.0367	0.0389	0.0394	0.036	0.0438	0.0491	0.0462	0.0598	0.0788	0.1046	0.081	0.1676
126583	Una persona è Livia, moglie di Colin Firth, che da più di un decennio è paladina di un impegno legato al rispetto per l'uomo e l'ambiente.	Costantemente lei denuncia all'opinione pubblica dei comportamenti poco etici, tipicamente nel settore della moda e del fast fashion.	0	0.0174	0.0329	0.0388	0.0345	0.0425	0.0565	0.0784	0.0937	0.0974	0.1195	0.1542	0.1519
88254	E nella mitologia greca, c'erano tante storie riguardo all'automazione, come quella del Pigmalione, in cui egli scolpì, un uomo che scolpì una statua di una donna, e s'innamorò di essa.	Bene, ad esempio questo complesso non esiste in Giappone.	1	0.0339	0.0625	0.0648	0.0513	0.0565	0.0547	0.0586	0.0775	0.1136	0.1594	0.1591	0.1492
6943	La maggior parte delle persone con cui parlo sono mie coetanee o sono poco più grandi di me.	Eppure hanno tutti alle spalle un grosso bagaglio di esperienze.	0	0.0311	0.044	0.0322	0.0227	0.03	0.0296	0.0315	0.0388	0.0468	0.0789	0.0584	0.0863
5001	"Tutti diciamo siti, ecco, introdotti da questa particella dismissiva ""ex"", perché non sono più, sono stati vettori, trattori del territorio."	Al loro interno si è lavorato, si è costruito reddito, economia, socialità, cultura; e poi si sono fermati.	0	0.0214	0.0416	0.029	0.0208	0.0258	0.0231	0.0222	0.0249	0.0277	0.0303	0.0286	0.0657
80909	E questa vita passata in montagna, ogni giorno ti porta a vedere lo stesso panorama con occhi sempre diversi.	Occhio, stai attento che qua ti fai male!	1	0.0501	0.0723	0.0649	0.0521	0.0565	0.0538	0.0628	0.072	0.0846	0.1404	0.2377	0.403
69215	E adesso, invece, vi faccio vedere questa diapositiva qua.	Mentre questa è Volterra, una cittadina di 9.000 abitanti.	1	0.034	0.0557	0.0485	0.0378	0.0532	0.0441	0.0448	0.0561	0.0662	0.074	0.105	0.2052
193762	Anzichè dire una giornata pesante, cosa potrei dire?	"""Giornata diversamente leggera"", che è gia meglio."	0	0.0438	0.0781	0.0636	0.0421	0.0446	0.0403	0.0485	0.0522	0.0607	0.1106	0.1772	0.2826
43553	Se questa è la realtà, per il momento, su cui l'Italia, nel suo ruolo di primo protagonista, stabilirà uno standard, non dobbiamo pensare che la cosa finisca qui.	Non ho il tempo di spiegare perché, ma non fonderanno gradualmente, in proporzione all'aumento della temperatura.	1	0.017	0.0545	0.0528	0.0395	0.0417	0.0305	0.0301	0.0303	0.0205	0.0229	0.0396	0.1715
185342	C'è un interessante esperimento, oltretutto fatto da un neuro - economista, il quale ha provato a mettere di fronte allo schermo una storia drammatica.	Per cui, man mano che la condizione emotiva sale, il nostro grado di attenzione cresce.	1	0.0227	0.0396	0.0431	0.0326	0.0335	0.0273	0.0285	0.0569	0.0679	0.0974	0.1592	0.192
78302	O semafori intelligenti?	Oppure pensate a una notizia di un paio di mesi fa, dove BMW e Mini hanno dovuto aggiornare, sempre via Internet, remotamente, le loro automobili perché tramite un'app sullo smartphone era possibile aprire le portiere, per esempio.	0	0.0754	0.1042	0.1064	0.0763	0.0788	0.0759	0.0835	0.1343	0.1575	0.2316	0.2406	0.1595
56245	Tanto cibo ancora buono finisce nel bidone della spazzatura nelle nostre case.	In Italia, se mettiamo assieme la filiera dal campo alla forchetta, dal campo alla tavola e tutti i passaggi che servono per portare il cibo nelle nostre case, la produzione agricola, la trasformazione dell'industra, la distribuzione grande, piccola, i mercati all'ingrosso, fino alla ristorazione...	0	0.0382	0.0801	0.0945	0.068	0.0839	0.0778	0.0923	0.1158	0.156	0.2158	0.3845	0.2959
138103	Penso alla macchina di Turing, allo sforzo di molti cervelli insieme, dagli scacchisti ai matematici, che riescono a decifrare il codice dei nazisti, e a far fare un salto di qualità enorme alla guerra che in quel momento forse senza di loro sarebbe stata persa.	Queste storie non vengono raccontate.	0	0.0542	0.0653	0.0828	0.0641	0.0671	0.0778	0.0946	0.1243	0.1489	0.1687	0.4073	0.4629
152648	Mentre, dove vedete i gialli e i rossi, quei territori sono carichi.	E questa è la differenza fra la Germania e noi.	1	0.026	0.0365	0.0303	0.0214	0.0321	0.0279	0.0305	0.0364	0.0479	0.0657	0.0592	0.1441
161718	Una montagna che per salirla devi essere molto allenato e preparato.	Quella montagna mi ha lasciato il dono più prezioso che tutti noi abbiamo: la vita.	0	0.0207	0.0313	0.0318	0.0239	0.0274	0.027	0.0252	0.0314	0.0534	0.0781	0.1105	0.2087
118196	"Noi abbiamo il becco di scrivere, nel primo articolo della Costituzione, ""L'Italia è una Repubblica democratica, fondata sul lavoro."""	Siamo l'unico paese che ha questo nel primo articolo della Costituzione, e siamo il peggiore paese, insieme alla Turchia, dell'Occidente.	0	0.0132	0.0212	0.023	0.0168	0.0198	0.0176	0.0176	0.0207	0.0206	0.0264	0.0553	0.0758
69041	Se qualcuno di noi ha avuto una persona malata vicina vede che quello che dice non arriva più, non sembra possibile più comunicare.	Anche tra le persone, tra chi più si vuole bene, nei rapporti umani è un'esperienza ben comune che a fronte di grandi intese ci sono momenti in cui non ci si capisce, in cui ci si scontra, in cui si litiga.	0	0.0259	0.0339	0.0484	0.0315	0.0315	0.0298	0.0438	0.0894	0.1203	0.1579	0.3142	0.2261
