Id	Sentence_1	Sentence_2	Class	Cosine_distance_layer_1	Cosine_distance_layer_2	Cosine_distance_layer_3	Cosine_distance_layer_4	Cosine_distance_layer_5	Cosine_distance_layer_6	Cosine_distance_layer_7	Cosine_distance_layer_8	Cosine_distance_layer_9	Cosine_distance_layer_10	Cosine_distance_layer_11	Cosine_distance_layer_12
109188	Quindi ci sono soggetti che finanziano questo tipo di ricerca atto a: la vendita successiva della conoscenza, quindi la potenziale vendita di vulnerabilità da sfruttare contro altri target; e ci sono poi hacker invece etici, che trovano vulnerabilità per il solo gusto di mettersi alla prova, di trovare vulnerabilità, di lavorare con chi ha creato questo software e metterlo in sicurezza.	Quindi da un lato abbiamo gli hacker etici: io, una cosa a cui tengo tantissimo è appunto fare la distinzione tra criminale, un normale criminale, sia esso informatico o meno, che trae profitto arrecando dei danni o arrecando, se vogliamo, disagi ad aziende e a persone; e l'hacker etico, il cui scopo appunto è di mettere in sicurezza questo mondo.	0	0.0108	0.0201	0.0294	0.0237	0.0203	0.0194	0.018	0.0245	0.0198	0.025	0.0274	0.0282
114670	Tariffa Puntuale introduces rewards and penalties for families and businesses in order to minimize non recyclable waste.	E quindi, a partire da questo concetto, abbiamo fatto un'innovazione, qualche anno fa, appunto, a Capannori inserendo, per la prima volta in Italia, un RFID, un microscopico microchip, che applicato nel sacco, o anche nel bilancino, inserisce appunto i dati dell'utenza, che quindi è registrata per ogni conferimento di materiale indifferenziato che fa.	1	0.0437	0.0727	0.0878	0.0612	0.061	0.0636	0.0719	0.0878	0.1037	0.1221	0.1374	0.3051
111689	In realtà, in un sistema completamente decentralizzato come Bitcoin, in cui non c'è un'autorità centrale come ad esempio una banca, a monitorare le transazioni e ad evitare frodi, si pongono alcuni problemi.	"Negli ultimi decenni, abbiamo quasi dato per scontato avere accesso al cosiddetto: ""Internet dell'informazione."""	1	0.0234	0.0375	0.0394	0.0242	0.0318	0.0329	0.0439	0.0504	0.0452	0.0515	0.076	0.0563
66739	Non lo devono più dare le banche.	Uno ha 150 anni ed è Pierre - Joseph Proudhon e l'altro è un moderno filosofo, leggermente figlio di buona donna, è Travis Kalanick, il fondatore Uber.	1	0.0506	0.0949	0.1097	0.0748	0.0724	0.0729	0.0766	0.1147	0.1321	0.1593	0.3707	0.2758
58851	Chi è il vero Francesco?	Chi è la vera società?	0	0.0186	0.0289	0.024	0.017	0.0239	0.0281	0.0259	0.029	0.0256	0.0432	0.0262	0.035
86306	Con il team giusto si arriva insieme al traguardo.	Il terzo ingrediente è l'ambiente.	0	0.0348	0.0602	0.0493	0.0381	0.0442	0.0434	0.0367	0.063	0.0958	0.2252	0.3803	0.2983
65886	Qualche anno fa ho ricostruito il network di collaborazione di 12.000 artisti di Hollywood per cercare di capire se il successo creativo si concentra al centro o ai margini del sistema.	"Non mi è venuta in mente una metafora migliore, per trasferire questa idea, che la seguente: ""Un braccio dentro, uno fuori""."	1	0.0185	0.0338	0.0326	0.0213	0.0209	0.0225	0.0197	0.029	0.0399	0.0689	0.0687	0.0894
187973	Quindi decisi di iscrivermi a lingue e letterature straniere, perché volevo andarmene via dalla campagna e dalla Sicilia.	Ma sempre il solito amico Fritz riuscì anche a inventare una formula del gas mostarda, chiamato iprite, perché venne utilizzato per la prima volta durante la prima guerra mondiale per testarlo ad Ypres, in Belgio.	1	0.0298	0.053	0.0433	0.035	0.04	0.0478	0.0461	0.0543	0.0581	0.0665	0.1765	0.276
198487	Addirittura, questi suoni ritornavano con una cadenza quasi regolare, che sembrava suggerirmi una melodia.	Soltanto dopo diventano cinesi, diventano americani, diventano italiani, francesi.	1	0.0358	0.0486	0.0484	0.036	0.0504	0.0569	0.0559	0.0687	0.0937	0.1167	0.0826	0.1796
161236	E andò in un villaggio turistico a Metaponto in Basilicata, per 350 euro al mese.	"Non c'è una persona che gli ha detto: ""Bravo, bella scelta!"	0	0.038	0.0644	0.0706	0.0643	0.07	0.0739	0.071	0.0843	0.133	0.1426	0.1229	0.1357
179458	Eppure vi stupirà, ma è proprio così che abbiamo fatto gli studi negli ultimi dieci anni, perché fino a pochissimo tempo fa non era possibile caratterizzare i pazienti.	Con la risonanza magnetica possiamo analizzare alterazioni nella massa e nella struttura del tessuto cerebrale, e possiamo identificare la presenza di lesioni vascolari.	1	0.0314	0.0503	0.0415	0.0388	0.0624	0.0561	0.0582	0.0762	0.1034	0.154	0.2314	0.2785
52546	Dobbiamo però anche considerare gli aspetti etici che ci pongono di fronte a queste prospettive.	Siamo veramente nel dominio della tecnica, ma quella tecnica che talvolta si pone come unico dio a cui la nostra società sembra oggi servire.	0	0.0243	0.0535	0.0425	0.0295	0.0314	0.0356	0.0336	0.0361	0.0392	0.0875	0.0549	0.105
114990	È quella fatta anche da molte, moltissime donne.	È il momento di ricucire i frammenti delle loro vite, come persone e come protagoniste degli eventi.	0	0.0354	0.0642	0.0534	0.04	0.0418	0.0533	0.0534	0.0638	0.0661	0.1172	0.2188	0.3389
64923	Questo è un esempio di cosa voglia dire 'aprire gli occhi'.	Andavo su, vedevo questo manifesto grosso, con un frigorifero e uno di questi fusti pieni di birra.	1	0.0258	0.0521	0.0525	0.0377	0.0443	0.0416	0.0388	0.0342	0.0397	0.0632	0.0774	0.1868
56339	Parla uno, parla l'altro, parla l'altra.	A un certo punto mi parte l'embolo e io comincio a preparare la mia risposta, non ascolto più gli altri.	0	0.0224	0.0363	0.0387	0.03	0.0357	0.0388	0.0466	0.0448	0.0374	0.0443	0.1283	0.0963
120365	Siete veramente sicuri che, nella vostra mente, uomini e donne siano associati nella stessa maniera alle discipline scientifiche?	Voglio fare insieme a voi un test in cui vi dimostrerò che, in realtà, voi non avete consapevolezza delle vostre vere credenze, cioè delle credenze che sono codificate nella vostra mente.	0	0.014	0.0238	0.0269	0.0191	0.0232	0.0251	0.0243	0.0285	0.0555	0.1165	0.2229	0.3455
13574	Fifth Avenue.	Questo era il mio modo di immaginarla.	0	0.0651	0.0844	0.0719	0.048	0.0496	0.039	0.0471	0.0528	0.0609	0.0885	0.5245	0.5095
92520	Questo che ti volevo chiedere, infatti pensi che questa cosa sia arrivata veramente nel cuore delle persone?	Sei riuscito a vedere concretamente qualcosa Sono usciti dalle loro capanne?	0	0.0337	0.077	0.055	0.0368	0.0353	0.0345	0.0453	0.0608	0.0583	0.0811	0.0833	0.1235
187699	Voi pensate che soltanto 10 anni fa, nel 2008, l'un percento della popolazione mondiale deteneva il 42% della ricchezza dell'intero pianeta.	E sapete oggi nel 2018 cosa è cambiato?	0	0.0521	0.0603	0.0546	0.0426	0.0454	0.0443	0.0489	0.0882	0.1066	0.1839	0.222	0.1837
185826	Potevamo iscriverli a una sezione speciale, come si fa spesso con le persone disabili.	Bene: in questo gioco, i due pizzaioli autistici sono arrivati entrambi nei primi 100.	1	0.0183	0.0272	0.0394	0.027	0.0286	0.0268	0.0258	0.0296	0.0297	0.047	0.074	0.1684
20318	Possiamo capire da dove queste cellule sono arrivate e soprattutto dove vogliono andare, e come si trasformano.	All'inizio di quest'anno abbiamo finito una ricerca con molti collaboratori di continenti diversi dove, per la prima volta, siamo riusciti a vedere come una cellula, come quella di sinistra, sotto la pressione di un farmaco, che inizialmente aiutava il paziente, la cellula si trasforma per non essere più prigioniera del farmaco.	0	0.0211	0.0371	0.0493	0.0484	0.0604	0.0563	0.066	0.083	0.119	0.1505	0.1546	0.1124
87487	E disegnando l'auto con quello che nel software chiamiamo programmazione a oggetti, cioè dividendo l'auto in moduli ben identificati a priori con delle interfacce stabili di collegamento fra di loro, dimodoché fosse possibile modificare e migliorare le singole parti dell'auto senza dover ridisegnare e stravolgere l'intero progetto.	Tutte le industrie possono beneficiare di queste idee.	1	0.0593	0.1049	0.11	0.085	0.0884	0.0808	0.088	0.1048	0.147	0.2246	0.275	0.2595
195142	A casa mia, con il boiler a nove metri, ci mette un po' più di tempo.	Perché in un hotel, o in un luogo pubblico di quel tipo, esiste un circuito di acqua che tiene continuamente in movimento l'acqua calda, per cui l'acqua calda scorre a pochi centimetri dal rubinetto, e quando lo aprite risponde.	0	0.0262	0.0434	0.0348	0.0199	0.0247	0.0284	0.0363	0.0382	0.0285	0.0257	0.0448	0.0533
198077	Mi chiederete: Ornella, ma qualcuno chi?	Matteo è un giovane studente che presta servizio presso un'associazione, un paio di volte la settimana.	0	0.0488	0.0694	0.0809	0.0547	0.0642	0.0628	0.0633	0.0805	0.1002	0.1296	0.3885	0.3812
51985	Beh, TED, io sono nato nel 1977.	Quello delle icone, delle finestre, ti ricordi?	1	0.0353	0.0541	0.038	0.0308	0.0308	0.0294	0.029	0.0365	0.0442	0.0854	0.0647	0.1319
141221	Spero che il design entri negli ospedali, nell'assistenza sociale.	E quando penso al quotidiano penso a questa ragazza: penso a Emily Pilloton.	1	0.0215	0.0323	0.0657	0.0472	0.0523	0.0481	0.0526	0.0763	0.0906	0.1522	0.3101	0.2785
70473	In alcuni casi, la sostituzione o la cancellazione di una sola lettera può indurre una modifica sostanziale in un carattere di una pianta o di un animale: in questo caso, per esempio, la cancellazione di una lettera nel riso rende il riso resistente a una malattia che si chiama brusone, e che di solito viene combattuta con dei pesticidi ad alto impatto ambientale.	Questa mutazione è presente in alcune varietà: quindi quello che fa l'editing, essenzialmente, è riuscire a copiare le soluzioni che sono state trovate dalla selezione naturale che sono presenti nelle razze locali e nelle varietà locali.	0	0.0149	0.0318	0.0322	0.0248	0.0296	0.0293	0.0322	0.051	0.0524	0.0655	0.0961	0.0774
50997	Sapete, se vi dico questo, è perché penso di averlo vissuto in prima persona in uno dei momenti più importanti nella vita di ognuno di noi, ovvero durante l'istruzione.	Io questa cosa purtroppo l'ho scoperta quando forse era un po' troppo tardi, ma sapete come sono diventato comunque un uomo libero, una persona migliore?	1	0.0147	0.0291	0.025	0.016	0.0187	0.0188	0.0205	0.0189	0.0144	0.0142	0.0317	0.14
31994	Anche quella che inizia con tanti nodi.	Datevi sempre l'opportunità di credere, di crescere, di aiutare.	0	0.0352	0.0487	0.0531	0.0357	0.0485	0.045	0.0451	0.0826	0.1229	0.1763	0.355	0.3744
105743	Quella crisi stimolò la ricerca di nuove fonti alternative al greggio.	Il riscaldamento del pianeta avviene a causa, principalmente dell'aumento della concentrazione di un gas considerato climalterante, il principale gas ad effetto serra, l'anidride carbonica, formula chimica CO2.	1	0.0343	0.0405	0.0485	0.037	0.0475	0.0497	0.0549	0.0884	0.136	0.1987	0.2893	0.3317
49064	Proprio qui fuori, sotto i Monti Parioli, c'è una frana lunga una cinquantina di metri che è transennata da anni.	Sottovalutiamo le frane perché il più delle volte fanno poche vittime.	0	0.0209	0.0504	0.0552	0.0349	0.0324	0.0337	0.0381	0.0546	0.0739	0.1193	0.2145	0.2366
30562	Oppure guardiamo quest'altro.	Ciascuno passa attraverso fasi di assestamento, stadi evolutivi, diciamo.	0	0.0481	0.0556	0.0639	0.0503	0.0622	0.0742	0.0774	0.0974	0.0976	0.1118	0.1852	0.2551
123095	In più vendere, in questo mondo, è difficile.	Quasi tutti i prodotti alla fine sono uguali.	0	0.0262	0.0273	0.0351	0.0216	0.0194	0.0169	0.0216	0.0365	0.0426	0.0668	0.0543	0.071
83772	È emerso che in questo periodo di tempo i ghiacciai di Lombardia si sono ridotti di 1, 5 km³ di ghiaccio, che vuol dire 1496 miliardi di litri di acqua in 26 anni.	Questo numerone, se lo dividiamo per i 26 anni, ci dà 57, 5 milioni di m³ di acqua all'anno, che i nostri ghiacciai non hanno perso, ci hanno donato, hanno rilasciato nel periodo estivo.	0	0.0099	0.0171	0.0345	0.0316	0.0418	0.0495	0.0479	0.0527	0.0667	0.0902	0.1097	0.0783
47736	Allora il nostro potere creativo risiede in ciò che noi possiamo fare nel nostro potenziale, non nel recintino di quello che sappiamo fare.	Quando siamo bambini, la caduta è uno step d'apprendimento.	1	0.0284	0.0431	0.0405	0.0346	0.0384	0.0498	0.0459	0.0723	0.1072	0.1658	0.2938	0.2402
172990	La partita di calcio, ovviamente ad alti livelli, è come se fosse un'equazione di 100 variabili, con 100 variabili, e voi dovete risolverla in un minuto: impossibile.	A questo punto, la domanda che mi fanno più spesso di tutti è: quanto coraggio ci vuole a scendere in campo, a prendere una decisione, a fischiare un rigore magari in una finale di Champions League.	1	0.0146	0.0243	0.0313	0.021	0.0191	0.0157	0.014	0.024	0.0551	0.0945	0.182	0.1318
192837	Bene, è il momento di rispondere.	Le donne non sono funzioni.	0	0.0287	0.026	0.03	0.0232	0.0326	0.0354	0.0356	0.0417	0.0548	0.1001	0.2797	0.1807
34853	"Come potete vedere, non sono gli individui all'estrema periferia ad avere il successo creativo massimo, i ""Renegade from the human race"" - appellativo che usò Dan Valentine, il più grande venture capitalist di tutti i tempi, quando incontrò per la prima volta, nel 1976, Steve Jobs."	Esplorare ambiti sociali non consuetudinari; leggere poesie se avete sempre letto libri di storia; imparare uno strumento musicale se non lo avete mai fatto; viaggiare nel sud del mondo se avete sempre viaggiato nel nord.	1	0.0304	0.0392	0.051	0.0468	0.0502	0.0451	0.0563	0.0655	0.0935	0.1088	0.1114	0.0808
178292	"La prima lezione dell'empatia, da questo punto di vista, sta proprio nel prestare ascolto, senza buttarci giù e dire: ""Vabbè, io sono egoista e quindi non mi interesso""."	La scienza sta lavorando molto su questo, e per esempio - questo secondo me è un risultato interessante - ci dice che non esistono le persone naturalmente empatiche.	1	0.0212	0.0365	0.0308	0.0243	0.025	0.0276	0.0247	0.0402	0.0587	0.0797	0.2101	0.2329
23030	Anche nell'Army Air Force, foto l'aeronautica militare, erano 40.000 le donne arruolate.	Nel '45 sono in missione all'estero, con oltre 200 ruoli professionali diversi, un esercito nell'esercito.	0	0.0197	0.0286	0.0278	0.0195	0.0179	0.0173	0.0165	0.015	0.0145	0.0214	0.0685	0.1335
116693	Davanti a un'inflazione di questo tipo cosa mai potrà valere una parola?	Viviamo in un mondo che noi stessi abbiamo reso rumoroso.	1	0.0273	0.0375	0.0492	0.035	0.0431	0.0415	0.0376	0.0474	0.0749	0.1288	0.5209	0.5354
121021	E quello che alleniamo di più è il braccio, è il muscolo dell'individuo e della competizione.	Perché è una parola che ci richiama qualcosa di negativo, come se fosse qualcosa di brutto già appunto a sentirlo dire, e spesso è utilizzato così.	1	0.0163	0.0298	0.0368	0.027	0.0238	0.0207	0.0232	0.0499	0.0748	0.1015	0.1839	0.1706
97510	E allora ho ridefinito la vita in questo modo: l'adolescenza come arte di sperare; la maturità come arte di morire; la terza età, o riparazione, come arte di essere fragili; e l'ultima, morire, o arte di rinascere.	Nell'adolescenza quello che accade - perché è l'arte di sperare?	0	0.0216	0.0506	0.0388	0.0311	0.0337	0.0384	0.0436	0.0405	0.0303	0.043	0.053	0.0692
150364	E quindi, io, adesso, guardando avanti, ho aggiunto una nuova parola.	"Mi è venuto in mente un libro che avevo letto di Gianrico Carofiglio: ""Le parole servono a comunicare e raccontare storie."	1	0.0243	0.0438	0.0501	0.0443	0.0564	0.0585	0.0534	0.0599	0.0746	0.0806	0.0805	0.1736
192435	Mangi questo o mangi quello?	Preferisci stare qui o andare altrove?	0	0.0272	0.0282	0.0262	0.0178	0.0268	0.0313	0.0349	0.037	0.0412	0.0625	0.1806	0.2301
92885	Pensate: piante che possono resistere alle malattie; che possono essere coltivate su terreni salini; che possono resistere alla siccità.	Comunque, diciamo che mettendo insieme queste tecnologie, ripensandoci: la genomica; le biotecnologie della riproduzione; l'editing, cioè copiare soluzioni dalle razze locali - mentre con la genomica, da sola, possiamo aumentare di tre volte la velocità di selezione, con questi sistemi messi insieme possiamo portare tutto in laboratorio, la selezione che stiamo facendo in campo la portiamo in laboratorio, e possiamo aumentare la velocità da 3X a 30X.	1	0.0321	0.0527	0.0745	0.0624	0.0687	0.0689	0.072	0.0813	0.1035	0.116	0.2152	0.1396
137266	Sarebbe come tradirlo.	Forse sbaglio qualcosa, mi sembra tutto così strano.	0	0.0389	0.0494	0.041	0.0247	0.029	0.046	0.1302	0.2043	0.2873	0.566	0.7139	0.4604
143269	Lo ripeto: si è riempita di debiti per comprare oggetti da mostrare nelle sue foto su Instagram.	Perché lei si era trasferita a New York, e quindi voleva vivere una vita da star.	0	0.0308	0.0709	0.0487	0.0358	0.0367	0.0344	0.0296	0.0346	0.0375	0.0677	0.0488	0.0704
60295	Io stessa mi sono trovata, spesso, a comprendere delle frasi che utilizzo quotidianamente solamente dopo che mi sono trovata a doverle tradurre con la lingua dei segni.	E proprio per questa limpidità di espressione, negli ultimi anni sono emersi moltissimi studi in Italia.	0	0.0201	0.0344	0.0299	0.0224	0.0229	0.027	0.0276	0.0337	0.0485	0.0689	0.0979	0.1798
20926	E questo è successo in molti casi: nella storia, la musica ha accompagnato le rivoluzioni.	Dalla Rivoluzione Francese, la musica popolare contro i nobili e le élite nobiliari di quel tempo; 100 anni più tardi, il Risorgimento italiano.	0	0.024	0.0332	0.0328	0.0234	0.0261	0.0289	0.0277	0.0295	0.0362	0.0454	0.0505	0.0629
182197	Quella di scavallare le colonne d'Ercole della nostra esistenza terrena, ciò che ci tiene qui, bloccati e un po' afflitti.	Ma, bene o male, la zuppa è la stessa.	1	0.0242	0.0407	0.05	0.0534	0.0584	0.0539	0.053	0.0743	0.0952	0.1361	0.207	0.177
108576	Folle, va bene.	La partecipazione di tutti, di tutto il paese.	1	0.0335	0.0488	0.0484	0.0401	0.0548	0.0664	0.1184	0.1479	0.2165	0.4248	0.6863	0.3059
90074	I nostri trasportatori ridevano e bevevano tequila.	In Messico è chiamato il Río Bravo, il fiume cattivo.	1	0.0346	0.0436	0.0362	0.027	0.0372	0.0371	0.0314	0.0347	0.0545	0.0973	0.1269	0.2025
84970	Poi, ho detto, sul deserto non sono preparato.	Eravamo qua di fianco Ha detto, guarda che purtroppo il grande bombino non riesce a venire.	1	0.035	0.0553	0.053	0.0382	0.0414	0.0361	0.0391	0.0473	0.0516	0.0765	0.1276	0.294
80392	Ho un buco al posto del cuore.	È una principessa che rifiuta in maniera assoluta, i limiti dentro di sé e nel mondo.	1	0.0357	0.05	0.0518	0.0445	0.0475	0.0459	0.0487	0.0594	0.0677	0.1029	0.1367	0.1181
41564	Doppio legame perché la relazione del bufago con l'ippopotamo è di parassitismo, e questo è un vantaggio, segnato in verde; ma è anche di dipendenza, perché dipende dal cibo che trova sulle spalle dell'ippopotamo.	La freccia rossa indica uno svantaggio.	0	0.0594	0.0798	0.0943	0.0852	0.0991	0.0943	0.1071	0.1437	0.1872	0.2296	0.3708	0.3163
36152	Questo non significa che dobbiamo abolire la scuola, ci mancherebbe altro, però perché esiste veramente la scuola?	Eppure sono sicuro che ognuno di noi, indipendentemente che la generazione sia la mia, che sia la vostra o quella dei vostri figli, se li avete, ognuno di noi, almeno una volta, ha pensato a questo.	1	0.032	0.0507	0.0385	0.026	0.0292	0.0254	0.0252	0.0347	0.0492	0.0732	0.0625	0.0778
63646	"C'è la fase della cosiddetta ""Luna di miele"", che è quella forse alla fine anche più pericolosa, anche più pericolosa dell'aggressione, perché fa pensare ad una donna che il pentimento e le attenzioni amorevoli che in quel momento il violento porta per riuscire a recuperare una situazione che forse sta perdendo di mano, eh, forse lo faranno cambiare, forse succederà qualcosa per cui non ci sarà più, quella situazione lì non si ripeterà."	Invece Leonor Walker ci dice proprio che questo è un ciclo che va a ripetersi, è un tunnel e noi quando intercettiamo le donne vorremmo che in quella fase, tra il secondo momento del maltrattamento e quello della luna di miele decidessero, perché quello è il momento giusto per poterne uscire, è il momento in cui lo sgomento si trasforma in paura, qui tornano i sentimenti di una guerra, e si può cambiare qualcosa.	0	0.0066	0.0241	0.0424	0.0286	0.0268	0.0229	0.0272	0.0247	0.0234	0.0219	0.018	0.0529
147944	Numero Uno: Punta sul prodotto e sul servizio, e non sulla pubblicità.	Apple ti dice qualcosa?	0	0.0675	0.0741	0.0712	0.0496	0.0589	0.0657	0.062	0.0615	0.0681	0.0948	0.1442	0.1434
161608	Girare il mondo.	"Quello che conta è saper accogliere il momento in cui finisce."""	1	0.0562	0.0666	0.0702	0.0454	0.0441	0.0433	0.0783	0.097	0.1469	0.4204	0.6568	0.3471
319	Sono io, sono il responsabile.	È un po' come quando in Italia succede qualcosa, un'alluvione, per l'amor del cielo, bisogna perseguire chi ha fatto degli errori, però a volte fin troppo, bisogna innanzitutto rimboccarsi le maniche.	1	0.0449	0.0793	0.0896	0.074	0.0746	0.0734	0.0815	0.1234	0.1316	0.1835	0.4534	0.3704
35754	Ed è la storia del suo risveglio.	Che svela il volto nascosto di un paese che ancora ospita, e nasconde, la follia tribale, e tutta la carica eversiva, di un carnevale delle origini.	1	0.0393	0.0553	0.0556	0.0504	0.0519	0.05	0.0486	0.0529	0.0555	0.0798	0.0728	0.0612
12034	Io ce la faccio!	Perché nessuno al mondo può dirci che non possiamo fare qualcosa.	0	0.0473	0.057	0.0762	0.0595	0.071	0.0676	0.0997	0.1244	0.1928	0.4089	0.7633	0.5554
190214	Mi ricordo le conversazioni che abbiamo avuto con sua mamma, con lei.	Ho chiesto quali erano i loro problemi.	0	0.0216	0.0275	0.0407	0.0286	0.03	0.0329	0.0335	0.0432	0.0555	0.08	0.1203	0.2162
30359	È una cosa un po' strana, ma grazie a dei giovani ricercatori e a una ricerca finanziata dalla comunità europea stiamo andando avanti in questa direzione.	La risposta è abbastanza semplice: perché produce un grande piacere.	1	0.0391	0.0405	0.0482	0.0444	0.0619	0.0607	0.0546	0.0659	0.1005	0.1291	0.1787	0.2067
154463	Piuttosto, e con questo concludo, focalizziamoci su due parole - chiave.	La prima: ascolto.	0	0.0526	0.0526	0.06	0.0415	0.0497	0.0573	0.0616	0.07	0.0745	0.0774	0.0912	0.1501
18512	Non ci sono più matrimoni tra minori.	Vogliono cambiare la società, e soprattutto dare una nuova speranza.	1	0.0398	0.055	0.0546	0.0329	0.0321	0.0301	0.0316	0.0334	0.0347	0.06	0.1449	0.1979
135004	Se invece gli date un'indicazione precisa vi porterà a destinazione.	E quindi sceglie di andare nella parte più difficile, di prendersi la responsabilità e di cominciare a mettere in campo tutte le azioni possibili e tutte le modifiche possibili per crearsi un obiettivo.	1	0.0344	0.0521	0.0577	0.0423	0.0415	0.0398	0.0403	0.0424	0.0718	0.0945	0.3476	0.5556
73986	Il bioritmo nostro si ricarica di nuovo, diventa normale, noi che eravamo così.	Ci si abitua?	1	0.0488	0.0764	0.0886	0.0596	0.0714	0.0588	0.0862	0.0957	0.1041	0.1648	0.3577	0.2996
81293	Un po' di sere fa stavo leggendo in soggiorno e ad un certo punto entra mio figlio di undici anni, con l'aria piuttosto abbattuta.	"Stava giocando ai videogiochi e poteva continuare ancora un po', quindi gli ho chiesto cosa fosse successo e lui mi ha detto: ""Sono morto troppe volte e mi sono stufato."""	0	0.016	0.0295	0.0315	0.0208	0.0216	0.0229	0.0262	0.0218	0.0173	0.0177	0.0347	0.0318
159643	"Poi conduco ""Troppo giusti"", un programma di cinema, ovviamente di Marco Giusti."	E a voi, che cosa vi fa sentire vivi?	1	0.0476	0.0603	0.0561	0.0428	0.058	0.0525	0.0532	0.0556	0.0627	0.1099	0.1135	0.1367
193052	Durante questo cammino, quello che io personalmente ho capito è che queste tecnologie non ci fanno più ricchi, più potenti.	Vi voglio porre una domanda.	1	0.0519	0.0699	0.0739	0.0601	0.0625	0.0958	0.1338	0.176	0.2592	0.5112	0.8264	0.5056
40729	Fatica intesa come sacrificio, voglia e disponibilità di rinunciare a certe cose per arrivare a un grande obiettivo.	La terza è consapevolezza.	0	0.0634	0.0715	0.0633	0.0448	0.0542	0.055	0.0546	0.0627	0.0632	0.0933	0.0869	0.1305
86453	Una bella cena nel periodo natalizio, con tutte le componenti dell'azienda e le famiglie.	"Cosa ti ha spinto a fare impresa? ""."	1	0.0554	0.0839	0.0772	0.0468	0.0494	0.0424	0.0415	0.0546	0.0904	0.1559	0.1839	0.2144
82670	Quando provate a guardarlo, non siete in grado di vederlo, nello stesso momento, da una parte e dall'altra.	In qualche modo, fa clic avanti e indietro o vi si stabilizza da una parte, poi dovete pensarci: forse c'è anche dall'altra.	0	0.0147	0.0226	0.0231	0.015	0.0181	0.0163	0.0223	0.0196	0.017	0.0181	0.0499	0.2666
50989	Quando avvengono quelle cose, siamo uno accanto all'altro.	"E non ci chiediamo ""chi è quello lì"", non è che lo misuriamo rispetto a quello - Abbiamo un compito di realtà urgente, e lo facciamo assieme."	0	0.0313	0.0481	0.0596	0.0433	0.0516	0.0572	0.0618	0.0742	0.092	0.1043	0.3384	0.398
182317	Questo primo viaggio è quello che ha dato il nome a tutto il progetto: Almost Europe.	Poi ho viaggiato da ovest a est, da Lisbona a San Pietroburgo e quest'anno ho intrapreso un viaggio lungo un'immaginaria diagonale da Cipro fino all'Islanda.	1	0.0206	0.0382	0.0371	0.0254	0.0309	0.0301	0.0281	0.0556	0.0887	0.1157	0.1619	0.1379
86121	Bene, adesso vi chiedo… Oh, siete già emozionati, ancora dobbiamo cominciare!	Vi chiedo cortesemente di prendere la mano destra del vostro nuovo partner, in questo modo, e di appoggiare i gomiti sul bracciolo della sedia.	0	0.033	0.0563	0.0504	0.0355	0.0381	0.0358	0.0333	0.04	0.06	0.0934	0.0576	0.0846
13383	Fermo, perché siamo oltre con i tempi.	Dovremmo imparare dai bambini e la creatività per me è la capacità di rievocare, di risvegliare il bambino che c'è dentro di noi.	0	0.0251	0.0583	0.055	0.0427	0.0495	0.0436	0.051	0.0856	0.0967	0.1445	0.3264	0.3531
8135	Famiglie che si separano.	Se uno guarda bene il percorso durante e dopo la terapia intensiva, vediamo che, in realtà, le istituzioni sanitarie e il tessuto sociale non sono assolutamente preparati a rispondere ai nuovi bisogni di cura che si creano.	0	0.051	0.0763	0.0709	0.0596	0.0743	0.0899	0.0988	0.133	0.1701	0.2143	0.3194	0.2638
