Id	Sentence_1	Sentence_2	Class	Cosine_distance_layer_1	Cosine_distance_layer_2	Cosine_distance_layer_3	Cosine_distance_layer_4	Cosine_distance_layer_5	Cosine_distance_layer_6	Cosine_distance_layer_7	Cosine_distance_layer_8	Cosine_distance_layer_9	Cosine_distance_layer_10	Cosine_distance_layer_11	Cosine_distance_layer_12
29327	Goldman Prize, che è un po' il Nobel dell'ambientalismo, nel 2015.	Se voi passeggiate per Cerro de Pasco, o per qualunque altra città mineraria, vi sembra di camminare in una città terremotata o bombardata.	1	0.0415	0.0555	0.0657	0.0468	0.0447	0.038	0.0394	0.0483	0.0742	0.0939	0.2783	0.3292
67142	Nonostante sia stato terminato come progetto, è stato interessante perché è stata la base per poter svilupparne altri di simili ovvero PuzzlePhone, finlandese, e Fairphone, che è olandese.	In più, si prestano benissimo questi moduli ad essere sostituiti da me senza dover andare in un centro riparazioni e quindi se si dovessero danneggiare o diventare obsoleti posso semplicemente ordinarne altri e acquistarli e cambiarli.	1	0.0232	0.0432	0.0322	0.0201	0.0216	0.0274	0.026	0.0297	0.0368	0.0469	0.0379	0.0602
9675	Non l'aveva mai visto.	Se l'era immaginato tante volte ma anche adesso che era vicina non ci andò.	0	0.0289	0.0407	0.0562	0.0422	0.0472	0.045	0.0654	0.0697	0.0478	0.0494	0.0613	0.0642
16322	E in quel momento senza nessun dubbio abbiamo deciso di scendere dalla montagna e quindi andare verso il campo base e fermarci lì.	Vedete, in quel momento ho capito una cosa molto importante.	0	0.0283	0.0393	0.0403	0.0317	0.0348	0.0348	0.0376	0.0537	0.0727	0.1131	0.0697	0.12
71604	I giornalisti di ProPublica, una testata investigativa americana indipendente, hanno analizzato 7 mila di questi punteggi, e guardandoli si sono accorti che le persone di colore venivano sistematicamente svantaggiate da questo algoritmo, ovvero che l'algoritmo associava la pelle scura a una maggior possibilità di compiere nuovamente reati.	Ora, come non è vero che i miei capelli rossi mi rendono più cattivo, non è vero che la pelle nera rende le persone più propense al crimine.	0	0.0246	0.053	0.0436	0.0352	0.0448	0.0422	0.0509	0.0602	0.089	0.1042	0.2357	0.1704
117820	Benedetta ha 30 anni, ed è country manager per l'Italia di una delle aziende che sta cambiando il modo di in cui le persone si muovono.	Questi ragazzi, la cui foto non è del 2007 ma è di due settimane fa, tutt'oggi stanno lavorando al progetto.	1	0.0096	0.0345	0.033	0.0232	0.0215	0.0186	0.0175	0.0153	0.0111	0.0138	0.0343	0.0458
84634	Un giorno, non per caso, ma per serendipità, feci una scoperta davvero straordinaria: scoprì il potere terapeutico della risata.	Ogni giorno al mattino, alle 4: 30, oltre a meditare, praticavo in solitudine la risata incondizionata.	0	0.0172	0.028	0.0198	0.0173	0.018	0.0191	0.0228	0.0272	0.0367	0.0379	0.0468	0.1073
162975	"Se è felice, perché lascia un pallino? """	"Mettete 5 pallini, e questa è la mia ""call to action""."	1	0.0327	0.0571	0.0518	0.0364	0.0367	0.0387	0.0395	0.0479	0.0608	0.1076	0.1391	0.1748
151969	Mi piace fare attività e la vela è veramente un mezzo ottimo, ottimo per tutti ragazzi meno fortunati, ottimo per tanta gente che non è fortunata.	Sì, all'Ospedale del Bambin Gesù fanno clownterapia, però ultimamente, per esempio, li portiamo in barca, portiamo in barca tutta la famiglia, quando ha finito di fare un ciclo di chemio molto pesante.	1	0.0234	0.0327	0.0355	0.0314	0.0338	0.0385	0.0429	0.0598	0.1093	0.1388	0.4058	0.344
155256	"E non ci chiediamo ""chi è quello lì"", non è che lo misuriamo rispetto a quello - Abbiamo un compito di realtà urgente, e lo facciamo assieme."	E funziona.	0	0.069	0.1082	0.1279	0.0877	0.101	0.1152	0.1578	0.1883	0.2843	0.5349	0.7966	0.4344
183537	La sua risposta fu disarmante nella sua semplicità.	E come fare a non pensare a T., una bambina che era figlia di uno dei contadini che lavoravano nel nostro progetto delle Nazioni Unite.	1	0.0392	0.0427	0.0401	0.0325	0.0391	0.0519	0.0659	0.0995	0.13	0.1981	0.5335	0.5413
17423	Ci sono sempre più studi che dimostrano come i servizi offerti al genere umano dalla biodiversità del suolo siano molteplici.	Io vi farò tre esempi.	0	0.0682	0.0729	0.0606	0.0418	0.0587	0.0632	0.0618	0.085	0.1137	0.1602	0.1415	0.3143
83194	Se oggi noi siamo così, nel bene o nel male, lo dobbiamo anche alla nostra capacità di ragionamento morale, alla capacità e alla voglia di entrare nelle situazioni con un'etica, con un'abitudine diversa dalla massa.	Questi siamo noi oggi.	0	0.0702	0.0802	0.0895	0.0635	0.0709	0.0776	0.1041	0.1368	0.1549	0.3405	0.6557	0.2905
187590	Il colore è anche, come dire, la trasposizione in quantità del colore - sulle pagine degli atlanti, vedete, razze e popoli corrispondono a delle cartouche colorate: come dire, convenzioni cromatiche per descrivere.	Il colore è inafferrabile.	1	0.0414	0.06	0.0692	0.0593	0.0665	0.056	0.0594	0.0667	0.0796	0.104	0.0755	0.1179
90842	Un'altra cosa molto importante che ho imparato negli anni di esplorazioni è che non serve andare lontano per fare esplorazione.	Non è necessario attraversare gli oceani, andare in altri continenti o in luoghi remoti.	0	0.0191	0.0272	0.0455	0.0435	0.0546	0.0441	0.0394	0.0574	0.0915	0.12	0.1943	0.2876
34947	E hanno imparato a leggere e a scrivere.	Poi per prova, senza rete, per fare innovazione, ne abbiamo dato uno anche alle donne.	1	0.0242	0.0509	0.0461	0.043	0.0483	0.0458	0.0469	0.0462	0.0574	0.083	0.0733	0.0939
130122	Hanno così poco, la loro prospettiva è di così corto raggio, che a emigrare non ci pensano.	Il loro problema è trovare la ciotola di riso fra due ore.	0	0.0234	0.0279	0.029	0.0215	0.0248	0.0226	0.0251	0.0245	0.0418	0.0697	0.0447	0.0568
161966	Partiamo dal piccolo, dall'individuo.	Io sono un genitore - ho due figlie - e l'idea che le mie figlie possano andare a giocare nel bosco mi stimola, mi emoziona; ma, dall'altra parte, non posso fare a meno di pensare che sono costantemente bombardato da notizie di rapimenti di bambini.	1	0.0285	0.0566	0.0514	0.0435	0.0459	0.0587	0.0813	0.0723	0.0622	0.0721	0.1264	0.2033
12896	Però sono essenziali, per molte imprese.	Se non ci fossero gli immigrati a fare questi lavori, queste imprese dovrebbero chiudere, togliere il lavoro a molti italiani che sono dediti a delle mansioni più elevate.	0	0.0358	0.0663	0.0671	0.0504	0.0534	0.0533	0.0549	0.0734	0.0761	0.0884	0.1464	0.2179
131074	Punto dieci: la notizia.	Signora, è ora di andare tutti a casa.	0	0.0402	0.0462	0.0411	0.0273	0.0359	0.047	0.0632	0.0695	0.0765	0.1999	0.6145	0.3042
9671	Io sono stata tossicodipendente dai 15 ai 20 anni.	Eroinomane, per la precisione, quindi mi facevo le iniezioni in vena di eroina, e per procurarmi i soldi per comprare l'eroina sono stata delinquente e mi sono anche prostituita.	0	0.0306	0.0494	0.0472	0.0313	0.034	0.0315	0.042	0.0659	0.096	0.1407	0.4506	0.4227
172553	Il problema è che questi cambiamenti, negli ultimi anni sono diventati talmente rapidi che la cucina deve evolversi ancora più rapidamente.	Quindi, innovazione.	0	0.0718	0.0823	0.1033	0.0808	0.0969	0.1051	0.1112	0.1336	0.1656	0.208	0.175	0.1689
77280	Le conseguenze le conosciamo tutti.	Invece, purtroppo, è anche stato dimostrato che quando questi flussi di informazioni ci sovrastano e diventano troppi, come oggi succede con i nostri telefonini, i nostri computer o i media, ci blocchiamo.	1	0.0513	0.0789	0.1045	0.0726	0.0721	0.0739	0.0944	0.1579	0.186	0.2151	0.1423	0.0952
39320	Perché oggi a causa dell'imprevedibilità ci affidiamo a delle strutture di questo tipo.	Ovvero, un punto centrale di cui tutti quanti ci fidiamo, ci conviene fidarci, le banche, gli stati, i quali si fanno carico di garantire che se sparo alla lepre e non sparo al cervo la dovrò pagare, ma il prezzo che tutta la collettività deve pagare per questo tipo di comodità è che quel punto centrale controlla tutto, cacciatori, lepri, cervi, fucili, tutto quanto.	0	0.0271	0.0663	0.0943	0.059	0.0722	0.0656	0.0738	0.0772	0.0579	0.0571	0.0588	0.0628
37936	Purtroppo, l'articolo inspiegabilmente non ha ancora attirato l'attenzione che meritava, però dita incrociate.	Ora, quello che dicevamo appunto: i premi igNobel.	0	0.0244	0.0364	0.0568	0.0387	0.0407	0.0364	0.0402	0.0724	0.097	0.1603	0.1253	0.0936
96716	Un esempio eclatante si tratta della Corporate Social Responsibility, o la cosiddetta responsabilità sociale d'impresa, è la voglia delle grandi, e piccole e medie imprese, di avere un impatto sociale positivo sulla comunità circostante.	Si tratta di utilizzare una piccola parte dei propri profitti al fine di contribuire a preservare il nostro pianeta, senza il quale non potremmo sopravvivere.	0	0.0221	0.0528	0.0662	0.0358	0.0373	0.035	0.0352	0.064	0.1175	0.1591	0.1621	0.1093
35532	"Quindi da una parte 'cosa"" e ""perché', dall'altra parte lasciare piena autonomia sul 'come' alle truppe."	Perché è giusto pianificare tavolino, studiare a priori il modo migliore per vincere la battaglia e per ottenere un risultato in azienda, ma nella realtà, nella realtà vera, è sul campo, in tempo reale, che le persone possono prendere le decisioni migliori, perché è solo lì che puoi decidere l'azione più corretta in funzione del contesto che cambia, la famosa incertezza della battaglia.	0	0.0357	0.0636	0.0476	0.0321	0.0383	0.042	0.0524	0.0405	0.0318	0.0407	0.0407	0.0722
114124	E cioè, un pannolino usato.	In Europa poco meno di 9 milioni di tonnellate, ogni anno, e in Italia un milione di tonnellate.	1	0.0392	0.0624	0.0681	0.0553	0.0644	0.0718	0.068	0.09	0.1216	0.153	0.1614	0.2393
84799	Adesso sì che possiamo rilevare le onde gravitazionali.	Possiamo giocare con le onde gravitazionali.	0	0.0204	0.0309	0.0295	0.0174	0.0188	0.017	0.0178	0.0222	0.027	0.0417	0.1177	0.1607
65390	Là sotto c'è il campo base, ma devi ancora avere benzina per tornare a casa.	Con tanta felicità logicamente.	1	0.0504	0.0542	0.0651	0.0489	0.0627	0.0723	0.0929	0.1677	0.2363	0.3115	0.3624	0.5769
3226	Per cui credere incredibilmente è un FARE, è un portarsi sul terreno dell'altro, è un portarsi al livello dell'altro, è un rendersi uguali.	E l'operazione più difficile è proprio rendersi uguali, è portarsi sul terreno dell'altro con la gioia di sentire che l'altro è la mia adrenalina, è la mia forza, è la mia vita.	0	0.0108	0.0181	0.0177	0.0117	0.0159	0.0147	0.0191	0.0154	0.0124	0.0133	0.0143	0.0205
108173	C'è il proprietario che è un tale rompiscatole: e quella roba lì non toccarla, e quella frutta non mangiarla.	Poi la storia la sapete.	1	0.0412	0.0668	0.0972	0.0703	0.0702	0.0588	0.0654	0.0852	0.1074	0.1486	0.3735	0.3652
68640	E invece - Altro che altezze spirituali: una rozza fanfara da caserma, con un'aria da canzonaccia da osteria!	Sentite cosa succede.	1	0.0786	0.111	0.125	0.0803	0.1019	0.0878	0.1091	0.1544	0.1751	0.2241	0.3681	0.2468
15143	Lui oggi è dai suoi figli e io sono potuto tornare a casa.	Ma adesso qual è il significato, a questo punto di affrontare queste montagne, soprattutto quando su in alta quota si è come dentro un congelatore.	1	0.0291	0.035	0.0426	0.0324	0.0413	0.0518	0.0465	0.0509	0.0506	0.0827	0.1327	0.1747
99047	Quindi di una generale sensazione di benessere e salute.	Questi sono dei parametri che per voi, magari, possono non avere senso, però che fanno capire che, al momento che il corpo va sotto stress calorico, accade qualcosa, è come se si risvegliassero all'interno delle nostre cellule dei geni che erano stati nascosti e addormentati per centinaia di migliaia di anni.	0	0.033	0.0851	0.1009	0.0842	0.1004	0.1003	0.1127	0.1207	0.1192	0.1608	0.1533	0.1113
36729	Voltaire diceva che la dignità di un Paese, la civiltà di un Paese si misura dalle sue carceri, ma è un'affermazione molto teorica.	"L'unica cosa che può fare nei periodi in cui non si trova in isolamento è leggere e ben presto inizia anche a scrivere e inizia a intrattenere una corrispondenza con uno scrittore famosissimo, Henry Miller, che crede nelle sue capacità, pubblica la loro corrispondenza sulla New York Review of Books e poi pubblica ""Nel ventre della bestia"", un libro, grazie al quale Abbott diventa anche molto ricco, viene messo in libertà, ma inebriato da questa situazione e dal suo carattere violento una sera in un bar uccide un cameriere per un banale litigio."	1	0.0233	0.0498	0.0574	0.0464	0.0482	0.0504	0.0555	0.0578	0.046	0.0447	0.0745	0.0975
46582	Con un'organizzazione, ovviamente; ma comunque da sola.	Questo è il mio principio fondamentale, attraverso il quale ho vissuto davvero tutta la mia vita, e devo tutto a mia madre.	1	0.0389	0.0575	0.0573	0.0359	0.044	0.046	0.0464	0.0807	0.1458	0.2964	0.7473	0.5582
77696	E di 5 modi per sconfiggerla e cambiare il mondo, un'idea alla volta.	Ciascuna di queste idee può fare un piccolo cambiamento, che però può toccare tante persone.	1	0.0275	0.0269	0.0353	0.0196	0.0227	0.0197	0.0185	0.0326	0.0765	0.1443	0.4405	0.522
16487	Mi stavi togliendo del tempo che dedicavi a delle case vecchie.	Restare a Parigi significava rincorrerci, voli permettendo; per cui abbiamo deciso di tornare a Favara, dove avremmo potuto vivere insieme il nostro quotidiano.	1	0.024	0.046	0.0482	0.0335	0.0408	0.0441	0.04	0.0525	0.0516	0.0795	0.2402	0.2845
35473	Quindi sapere da dove state partendo è assolutamente fondamentale.	Questa è una cosa che non facciamo volentieri, e quindi di solito lasciamo quelle parti del cervello spente.	1	0.0237	0.0289	0.0331	0.0314	0.0394	0.0531	0.045	0.0818	0.1165	0.1348	0.1616	0.2522
101308	Ma forse non sapete quanto siano importanti i microbi che vivono all'interno delle radici delle piante.	Un batterio interessante è un particolare tipo di bacillus, che vive all'interno delle radici di piante orticole.	0	0.0211	0.0347	0.031	0.0174	0.0169	0.0213	0.0267	0.0271	0.0222	0.0207	0.0664	0.1391
151142	Che cosa vedere in questa immagine?	La vulnerabilità, ma anche la forza e la determinazione nel raggiungere i propri obiettivi.	0	0.0647	0.0831	0.0679	0.044	0.0472	0.0485	0.053	0.0512	0.0676	0.1194	0.1243	0.2097
137203	Dall'altro lato, guardiamo però questo paese.	Questa dimensione individuale di drammatica scelta ha portato a un bassissimo tasso di natalità.	0	0.0448	0.0554	0.067	0.0541	0.0593	0.0692	0.0759	0.0896	0.1073	0.1622	0.3792	0.2906
1657	Non sono affettuosi, non cercano assolutamente di compiacerci, non gli interessa il contatto fisico.	Lo permettono, ma non è una cosa fondamentale per instaurare un rapporto con loro.	0	0.0196	0.0309	0.0292	0.0168	0.0235	0.0195	0.0193	0.0222	0.0256	0.0358	0.0523	0.0784
174815	Per quale ragione?	Perché ogni errore fatto in quel momento lo avrei ripagato a casa, non avendo magari lo scatto necessario.	0	0.0501	0.0865	0.0917	0.0636	0.0832	0.0758	0.0937	0.1471	0.2791	0.3255	0.1702	0.2441
56295	Be', dai, non mi sono sbagliata, insieme abbiamo fatto tante cose, abbiamo fatto scoperte sorprendenti, tanti incontri impensati.	Abbiamo imparato muoverci in sincronia e a metterci in gioco con fiducia reciproca, e solamente accettando il rischio di non farcela, insieme, possiamo arrivare in cima.	1	0.0202	0.0291	0.0459	0.0402	0.0427	0.0467	0.0479	0.0438	0.0644	0.0897	0.0767	0.1151
79053	Fatelo anche voi.	Ammazza quanti siete!	1	0.0391	0.0418	0.0454	0.0306	0.0499	0.0463	0.0615	0.0837	0.1396	0.3024	0.1964	0.3076
33031	E quindi viviamo l'epoca nella quale contiamo i like, contiamo le condivisioni, contiamo i retweet, contiamo i follower.	In un momento qualsiasi uno di voi può aprire lo smartphone, condividere qualcosa su uno dei social media e avere un risultato immediato.	0	0.0407	0.0728	0.0554	0.0448	0.0499	0.0504	0.056	0.0947	0.1599	0.3494	0.5252	0.4864
74576	E diciamo anche che il mondo si rende molto più complicato, per molte - ma non tutte - delle nostre aspirazioni la misura in cui riusciamo a raggiungerle dipenderà dalla bontà della tecnologia che siamo riusciti a costruire.	Una cosa però.	0	0.0687	0.1324	0.1301	0.0915	0.0915	0.0863	0.1412	0.184	0.2058	0.3717	0.6588	0.3873
63912	Quelle belle vene d'oro che si vedono nei film?	999 chili e 999 grammi sono spazzatura.	1	0.0407	0.0465	0.0477	0.0349	0.0357	0.0337	0.0296	0.0518	0.1004	0.1779	0.2785	0.2945
142465	A me personalmente mi si forma un piccolo mattone qua, sul petto, che mi impedisce di finire bene il respiro.	E quindi inizio a cercarmi delle evasioni, un po' di spazio solo per me.	1	0.0198	0.0296	0.0377	0.0211	0.0268	0.0315	0.0287	0.0462	0.0784	0.1259	0.5063	0.4028
148185	E da quei giorni così difficili ho raccolto gli insegnamenti più grandi che potessi ricevere.	La consapevolezza che non ci conosciamo mai fino in fondo, e che i nostri limiti sono ben al di là di quello che possiamo immaginare; che bisogna utilizzare la volontà, questo motore così potente che abbiamo.	0	0.0289	0.0551	0.0491	0.0351	0.0418	0.0386	0.0362	0.0421	0.0419	0.0532	0.1362	0.1514
15871	Finalmente avevo ritrovato i miei sogni: viaggiare, scrivere, fotografare e sognare, senza fretta, con calma.	Finalmente l'idea era chiara nella mia testa: sarei ritornata in Italia e me la sarei fatta tutta a piedi, raccogliendo sogni: cercando di stimolare nella gente che avrei incontrato quello che era successo a me quella notte magica.	0	0.0204	0.0285	0.0419	0.0397	0.0448	0.0411	0.0433	0.0663	0.0862	0.1139	0.2765	0.2956
9495	Fa riscaldamento per sé, per non farsi male, però nel momento in cui lo fa dà aiuto anche alla squadra.	Che non è una brutta malattia, mia zia è cintura nera in meteoropatismo.	1	0.0323	0.0526	0.0717	0.0498	0.0543	0.0495	0.0441	0.0528	0.0652	0.1118	0.192	0.2487
187073	È successo.	"È nata la cucina, e la cucina è talmente importante che addirittura, ad oggi, in tanti ospedali stiamo studiando la cosiddetta ""Terapia del pasto"", perché mangiare bene dal punto di vista sensoriale, favorisce le guarigioni, le accelera."	1	0.0955	0.1405	0.1908	0.1331	0.1478	0.1299	0.1457	0.1838	0.2042	0.2602	0.1617	0.1811
76848	Oppure abbiamo visto dei cervelli dentro delle macchine… e ridevamo... science fiction, fantascienza.	Ma se noi riattacchiamo la testa di un anziano sul corpo di un giovane… Cosa succede?	1	0.0255	0.0373	0.0372	0.027	0.0293	0.0339	0.0349	0.0436	0.0514	0.077	0.1506	0.3409
4249	Pensa a proteggere se stessa, a consumare poche energie, ha questo istinto di autoconservazione e, per fare questo, non esita a mentirci.	Immediatamente scatta un allarme e inonda il sangue con sostanze che ci fanno reagire.	1	0.0151	0.0255	0.0342	0.0226	0.0235	0.0213	0.0245	0.0322	0.0356	0.0461	0.0419	0.0582
164423	Tutti hanno diritto di provare, perché Chiara possa raccontare a Tiziana un libro.	Sono otto anni che Chiara arrampica.	1	0.0261	0.0472	0.0414	0.0297	0.0384	0.0402	0.0459	0.0763	0.0835	0.1056	0.1113	0.242
85994	E così, nel 1919, fu avviata la costruzione di un imponente idrovolante, talmente grande da guadagnarsi il soprannome di Palazzo con le Ali.	Furono infatti molti quelli che mossero contro Caproni, criticando aspramente la sua idea, ritenendola inattuabile in quanto troppo audace.	1	0.0253	0.0522	0.0503	0.0373	0.0393	0.0305	0.0315	0.0285	0.043	0.0868	0.0775	0.0857
185998	3 decise di lanciare il primo videofonino e mi chiese di realizzare una delle prime trasmissioni televisive al mondo, pensate per il videofonino.	"Si chiamava ""Italian Job"" e raccontavamo le professioni nuove degli Italiani."	0	0.0318	0.0538	0.0409	0.0306	0.0312	0.0289	0.028	0.0345	0.0296	0.0471	0.0328	0.0639
108421	Dopo, col tablet, la comunicazione è cambiata, Chiara vi racconta di una zuffa tra il coniglio King e il coniglio Cherry, e di come si è sentita lei.	"""Coniglio"" ""Cherry"" ""io triste"" ""Coniglio Cherry ferita a coniglio King - io triste"" Per la prima volta, Chiara poteva comporre le sue frasi e poteva dirle con una voce che decideva lei quando fare uscire e come, con la sintesi vocale del tablet."	0	0.0257	0.0352	0.0301	0.0188	0.0242	0.0356	0.034	0.0455	0.043	0.0505	0.0631	0.1619
79679	Il colloquio dev'essere un colloquio dinamico, nel quale devo vedere quello che vogliono sapere ma deve essere un colloquio scientificamente valido.	"E allora, quello di condividere e comunicare anche col bambino diventa un momento, perdonatemi il termine, ""vincente""."	1	0.028	0.0418	0.0399	0.0289	0.0258	0.023	0.0241	0.0415	0.0694	0.1312	0.1984	0.2226
77851	Da quattro anni passo la maggior parte della mia vita a bordo di una nave di Sea Shepherd.	È un'organizzazione internazionale che si occupa di oceani.	0	0.0278	0.0501	0.0552	0.0349	0.0403	0.038	0.0323	0.0601	0.0739	0.1062	0.3594	0.4355
119526	Da più di 10 anni noi rinnoviamo e ricambiamo questa promessa, spendendo la maggior parte del nostro tempo su palcoscenici molto diversi da questo.	TEDx è un avamposto meraviglioso, unico, dove esibirsi: eppure ci sono stati tempi senza risposta.	0	0.0168	0.0327	0.03	0.0284	0.0341	0.0301	0.0305	0.037	0.0381	0.059	0.1728	0.2383
20089	Allora Nemo serve per dire la verità e questi occhi a me sanno di verità.	Questa è la maschera tipica del teatro greco.	1	0.033	0.0359	0.0316	0.0293	0.0428	0.0437	0.0508	0.0684	0.0726	0.1054	0.1212	0.2857
139512	Ed è vero, probabilmente è vero che è impossibile; è impossibile a meno che, però, non ti butti a capofitto nello studio, nell'approfondimento di tematiche che magari, per te, sono molto lontane.	Fino a quel momento no, non ci avevo mai pensato, Molto probabilmente perché, come molti di voi, sono nato e cresciuto in una città che mi ha formato su assunti ben chiari.	1	0.0111	0.0347	0.0299	0.022	0.0276	0.0236	0.0242	0.0317	0.0572	0.068	0.0909	0.0885
22572	Questo edificio, che è bruttino, lo ammetto, ma l'ha costruito il mio bisnonno, ed è arrivato a me dopo la perdita di mio padre.	Un giorno, la mia insegnante di yoga mi disse che per la religione induista l'universo è perfetto, che c'è equilibrio in tutto.	1	0.0251	0.0282	0.0229	0.0172	0.018	0.018	0.0207	0.0205	0.0161	0.0173	0.0305	0.1727
172587	Avanzavo, tirata da una, tirata dall'altra, cercando di gratificare una e cercando di gratificare quell'altra.	Però è una diversità che è tutto sommato banale.	1	0.0556	0.06	0.0573	0.0408	0.0443	0.0406	0.0446	0.064	0.0915	0.1437	0.3249	0.3336
98982	Perché nella nostra blockchain dobbiamo sempre essere liberi di avere il cervo davanti, abbassare il fucile e non sparargli.	"Pensate a ""un'espressione felice""; ""lo scrittore ha elaborato un'espressione felice""; oppure ""l'avventura ha avuto un esito felice""."	1	0.0389	0.0972	0.0782	0.0466	0.0433	0.038	0.0418	0.0618	0.0763	0.1063	0.1187	0.1031
179322	Ne avete mai parlato?	Siete proprio sicuri?	1	0.0427	0.0433	0.044	0.029	0.0404	0.0388	0.0528	0.075	0.133	0.1878	0.1223	0.1808
59221	Guardate quante cose che abbiamo sotto il nostro controllo, e non ce ne rendiamo conto.	È questo che voglio dire, il significato che gli diamo ci darà un'emozione.	1	0.0232	0.026	0.0374	0.0234	0.0263	0.0253	0.0244	0.0367	0.0746	0.1104	0.5055	0.5219
1011	E quindi anche il concetto di riciclo delle cose che noi usiamo in tutti i giorni è sicuramente fondamentale, ma non è la risposta ultima.	Ora vediamo un filmato, qui a sinistra, dove ad ogni fotogramma si scambiano di ordine due tessere, a caso, si prendono due tessere a caso e le si scambia.	1	0.028	0.0436	0.04	0.029	0.0337	0.0273	0.0264	0.025	0.0363	0.0855	0.2218	0.2322
63508	La polvere di grafite, vi assicuro, è meravigliosa e io riesco a vederla solo come materia prima.	Finisce in discarica, direttamente sotto terra.	1	0.0393	0.0602	0.0545	0.0398	0.0516	0.0531	0.0522	0.0647	0.0944	0.0917	0.0762	0.0826
9911	E in che cosa si trasforma questa energia che non si incanala in delle strutture che si sono formate nel corso di millenni?	Si trasforma in disordine, si trasforma in imprevedibilità.	0	0.0312	0.0468	0.0453	0.0395	0.0508	0.0519	0.0539	0.0555	0.0685	0.1027	0.0928	0.1014
28379	"E di fare uno studio che dal nome stesso, dal titolo stesso del progetto, ""Moli - sani"", sottolinea e indica chiaramente che siamo interessati di più alla salute che alla malattia."	E siamo interessati di più a capire cosa c'è prima, cosa c'è all'origine del benessere dell'uomo.	0	0.017	0.0303	0.0592	0.05	0.0541	0.0498	0.0553	0.0647	0.077	0.0775	0.0672	0.1272
40528	Quindi io arrivo a Almaty, prendo 25 ore di treno per andare sul lago di Aral, che come vedete non è molto ospitale.	Sto lì un giorno o due e poi prendo 25 ore di treno per tornare indietro.	0	0.0219	0.0264	0.0245	0.0174	0.0214	0.0241	0.027	0.031	0.0379	0.0697	0.132	0.2011
6725	Però non c'è molto tempo, perché qua abbiamo soltanto 30 giorni.	E quindi ci mettiamo noi due, con il mio socio, che è la prima persona a cui io ho telefonato quando abbiamo vinto il bando, e insieme a lui e agli altri amici storici del calcetto realizziamo un'organizzazione no profit in fretta e in furia per realizzare quella missione e per aprirlo il campetto.	0	0.0423	0.0691	0.0621	0.0499	0.0506	0.058	0.0694	0.0595	0.0466	0.0924	0.3254	0.2449
133952	Perché son stato giovane anch'io e quando ero giovane mi sono innamorato di questo fenomeno della superconduttività, c'ho cominciato a lavorare e poi dal 2008 ho cominciato a lavorare da professore dell'Università di Milano all'LHC, alle prime idee eccetera, e quindi sono venuto diverse volte qui a Schio.	Non posso spiegarvi che cos'è, questo sarebbe tutto un altro TEDx appunto, però è un fenomeno meraviglioso.	1	0.0223	0.0364	0.0433	0.0301	0.0333	0.0356	0.0469	0.0409	0.0312	0.0392	0.0377	0.06
194776	Passiamo dalla scoperta individuale a quella globale, geostrategica.	Se l'Occidente, per magia, decidesse di nutrirsi secondo la piramide, non solo staremo un po' tutti meglio, ma si scardinerebbe la polarizzazione del mondo fra un miliardo e mezzo di persone che soffrono di patologie per errata o eccessiva nutrizione, e 814 milioni di persone che soffrono la fame.	0	0.0285	0.0493	0.0558	0.0486	0.0575	0.0528	0.0635	0.0995	0.1212	0.1561	0.1773	0.1581
